A4: CLIENT: | C4: XYZ
A7: ADDRESS: | C7: 123 Avenue
C8: New York, N.Y.10017
A10: PREMISES: | C10: Common Area(New)
A13: KW: | C13: 1608.1
A16: KWHR: | C16: 313038
A19: UTILITY RATE: | C19: Consolidated Edison SC-4 II Rate in effect March | H19: =+RatesFuelTax!D2 -> 2000
A22: ENERGY:
C23: On-Peak | D23: Kwhr: | E23: 222202 | F23: @ | G23: =+RatesFuelTax!B10 -> 4.58E-2 | H23: =E23*G23 -> 10176.8516
C24: Off-Peak | D24: Kwhr: | E24: 90836 | F24: @ | G24: =+RatesFuelTax!C10 -> 3.6299999999999999E-2 | H24: =E24*G24 -> 3297.3467999999998
A26: DEMAND:
C27: KW: | E27: 1608.1 | F27: @ | G27: =+RatesFuelTax!D10 -> 15.67 | H27: =E27*G27 -> 25198.927
A29: FUEL ADJUSTMENT: | D29: Kwhr: | E29: 313038 | F29: @ | G29: =+RatesFuelTax!E10 -> 2.0899999999999998E-2 | H29: =E29*G29 -> 6542.4941999999992
D31: Sub-Total | H31: =SUM(H23:H30) -> 45215.619599999998
A33: GROSS RECEIPT TAX: | E33: =+RatesFuelTax!F10 -> 6.8686999999999998E-2 | H33: =H31*E33 -> 3105.7252634652
D35: Sub-Total | H35: =SUM(H31:H34) -> 48321.344863465201
A37: SALES TAX: | E37: 8.2500000000000004E-2 | H37: =H35*E37 -> 3986.5109512358795
A39: CHARGE PER MONTH: | H39: =SUM(H34:H38) -> 52307.855814701077