A4: CLIENT: | C4: XYZ
A7: ADDRESS: | C7: 123 Avenue
C8: New York, N.Y.10017
A10: PREMISES: | C10: Common Area(New)
A13: KW: | C13: 1760
A16: KWHR: | C16: 405553
A19: UTILITY RATE: | C19: Consolidated Edison SC-4 II Rate in effect June | H19: =+RatesFuelTax!D2 -> 2000
A22: ENERGY:
C23: On-Peak | D23: Kwhr: | E23: 292406 | F23: @ | G23: 0.11269999999999999 | H23: =E23*G23 -> 32954.156199999998
C24: Off-Peak | D24: Kwhr: | E24: 113147 | F24: @ | G24: 4.8500000000000001E-2 | H24: =E24*G24 -> 5487.6295
A26: DEMAND:
C27: KW: | E27: 1760 | F27: @ | G27: 31.29 | H27: =E27*G27 -> 55070.400000000001
A29: FUEL ADJUSTMENT: | D29: Kwhr: | E29: 405553 | F29: @ | G29: =+RatesFuelTax!E13 -> -5.4739999999999997E-3 | H29: =E29*G29 -> -2219.9971219999998
D31: Sub-Total | H31: =SUM(H23:H30) -> 91292.188578000001
A33: GROSS RECEIPT TAX: | E33: =+RatesFuelTax!F13 -> 6.8462999999999996E-2 | H33: =H31*E33 -> 6250.1371066156134
D35: Sub-Total | H35: =SUM(H31:H34) -> 97542.325684615615
A37: SALES TAX: | E37: 8.2500000000000004E-2 | H37: =H35*E37 -> 8047.2418689807882
A39: CHARGE PER MONTH | H39: =SUM(H34:H38) -> 105589.5675535964