B6: CLIENT: | D6: XYZ
B8: ADDRESS: | D8: 123 Avenue
D9: New York,N.Y.10017
B11: PREMISES: | D11: =+RatesFuelTax!D2 -> 2000 | E11: Monthly Summary of Common Area Cost(New)
B14: JANUARY | H14: =+JAN!H39 -> #VALUE!
B16: FEBRUARY | H16: =+FEB!H39 -> 54357.201329613985
B18: MARCH | H18: =+MAR!H39 -> 52307.855814701077
B20: APRIL | H20: =+APR!H39 -> 51070.583683042809
B22: MAY | H22: =+MAY!H39 -> 55554.659542162088
B24: JUNE | H24: =+JUN!H39 -> 105589.5675535964
B26: JULY | H26: =+JUL!H39 -> 111008.70023333508
B28: AUGUST | H28: =+AUG!H39 -> 118168.07200610852
B30: SEPTEMBER | H30: =+SEP!H39 -> 112933.28271277486
B32: OCTOBER | H32: =+OCT!H39 -> 59538.441548403272
B34: NOVEMBER | H34: =+NOV!H39 -> 67772.006052913799
B36: DECEMBER | H36: =+DEC!H39 -> 68969.349240648022
D38: TOTAL COST FOR | G38: =+RatesFuelTax!D2 -> 2000 | H38: =SUM(H14:H37) -> #VALUE!