A4: CLIENT: | C4: XYZ
A7: ADDRESS: | C7: 123 Avenue
C8: New York, N.Y.10017
A10: PREMISES: | C10: Common Area(New)
A13: KW: | C13: 1608.1
A16: KWHR: | C16: 313038
A19: UTILITY RATE: | C19: Consolidated Edison SC-4 II Rate in effect December | H19: =+RatesFuelTax!D2 -> 2000
A22: ENERGY:
C23: On-Peak | D23: Kwhr: | E23: 222202 | F23: @ | G23: =+RatesFuelTax!B19 -> 9.3850000000000003E-2 | H23: =E23*G23 -> 20853.6577
C24: Off-Peak | D24: Kwhr: | E24: 90836 | F24: @ | G24: =+RatesFuelTax!C19 -> 5.4100000000000002E-2 | H24: =E24*G24 -> 4914.2276000000002
A26: DEMAND:
C27: KW: | E27: 1608.1 | F27: @ | G27: =+RatesFuelTax!D19 -> 20.91 | H27: =E27*G27 -> 33625.370999999999
A29: FUEL ADJUSTMENT: | D29: Kwhr: | E29: 313038 | F29: @ | G29: =+RatesFuelTax!E19 -> 7.5799999999999999E-4 | H29: =E29*G29 -> 237.282804
D31: Sub-Total | H31: =SUM(H23:H30) -> 59630.539104000003
A33: GROSS RECEIPT TAX: | E33: =+RatesFuelTax!F19 -> 6.8462999999999996E-2 | H33: =H31*E33 -> 4082.4855986771518
D35: Sub-Total | H35: =SUM(H31:H34) -> 63713.024702677154
A37: SALES TAX: | E37: 8.2500000000000004E-2 | H37: =H35*E37 -> 5256.3245379708651
A39: CHARGE PER MONTH: | H39: =SUM(H34:H38) -> 68969.349240648022