A4: CLIENT: | C4: XYZ
A7: ADDRESS: | C7: 123 Avenue
C8: New York, N.Y.10017
A10: PREMISES: | C10: Common Area(New)
A13: KW: | C13: 1608.1
A16: KWHR: | C16: 313038
A19: UTILITY RATE: | C19: Consolidated Edison SC-4 II Rate in effect May | H19: =+RatesFuelTax!D2 -> 2000
A22: ENERGY:
C23: On-Peak | D23: Kwhr: | E23: 222202 | F23: @ | G23: 6.0199999999999997E-2 | H23: =E23*G23 -> 13376.560399999998
C24: Off-Peak | D24: Kwhr: | E24: 90836 | F24: @ | G24: 4.3900000000000002E-2 | H24: =E24*G24 -> 3987.7004000000002
A26: DEMAND:
C27: KW: | E27: 1608.1 | F27: @ | G27: 18.96 | H27: =E27*G27 -> 30489.576000000001
A29: FUEL ADJUSTMENT: | D29: Kwhr: | E29: 313038 | F29: @ | G29: =+RatesFuelTax!E12 -> 5.6999999999999998E-4 | H29: =E29*G29 -> 178.43165999999999
D31: Sub-Total | H31: =SUM(H23:H30) -> 48032.268460000007
A33: GROSS RECEIPT TAX: | E33: =+RatesFuelTax!F12 -> 6.8462999999999996E-2 | H33: =H31*E33 -> 3288.4331955769803
D35: Sub-Total | H35: =SUM(H31:H34) -> 51320.701655576988
A37: SALES TAX: | E37: 8.2500000000000004E-2 | H37: =H35*E37 -> 4233.9578865851017
A39: CHARGE PER MONTH: | H39: =SUM(H34:H38) -> 55554.659542162088