A4: CLIENT: | C4: XYZ
A7: ADDRESS: | C7: 123 Avenue
C8: New York, N.Y.10017
A10: PREMISES: | C10: Common Area(New)
A13: KW: | C13: 1608.1
A16: KWHR: | C16: 313038
A19: UTILITY RATE: | C19: Consolidated Edison SC-4 II Rate in effect February | H19: =+RatesFuelTax!D2 -> 2000
A22: ENERGY:
C23: On-Peak | D23: Kwhr: | E23: 222202 | F23: @ | G23: =+RatesFuelTax!B9 -> 4.58E-2 | H23: =E23*G23 -> 10176.8516
C24: Off-Peak | D24: Kwhr: | E24: 90836 | F24: @ | G24: =+RatesFuelTax!C9 -> 3.6299999999999999E-2 | H24: =E24*G24 -> 3297.3467999999998
A26: DEMAND:
C27: KW: | E27: 1608.1 | F27: @ | G27: =+RatesFuelTax!D9 -> 15.67 | H27: =E27*G27 -> 25198.927
A29: FUEL ADJUSTMENT: | D29: Kwhr: | E29: 313038 | F29: @ | G29: =+RatesFuelTax!E9 -> 2.6558999999999999E-2 | H29: =E29*G29 -> 8313.9762420000006
D31: Sub-Total | H31: =SUM(H23:H30) -> 46987.101641999994
A33: GROSS RECEIPT TAX: | E33: =+RatesFuelTax!F9 -> 6.8686999999999998E-2 | H33: =H31*E33 -> 3227.4030504840534
D35: Sub-Total | H35: =SUM(H31:H34) -> 50214.50469248405
A37: SALES TAX: | E37: 8.2500000000000004E-2 | H37: =H35*E37 -> 4142.6966371299341
A39: CHARGE PER MONTH: | H39: =SUM(H34:H38) -> 54357.201329613985