C3: Sub-Metered Revenue | E3: Rent Inclusion Revenue | G3: MAC Adjustment Revenue | I3: Electric Expense | K3: Recovery Factor
A4: Month | C4: 1999 | D4: 2000 | E4: 1999 | F4: 2000 | G4: 1999 | H4: 2000 | I4: 1999 | J4: 2000 | K4: 1999 | L4: 2000
A5: JAN | C5: 66758.45 | D5: 87104.79 | E5: 443687.2 | F5: 442468.31 | G5: 0 | H5: 88605.41 | I5: =276271.54+9685.74 -> 285957.28 | J5: 346576.68 | K5: =SUM(C5+E5+G5)/I5 -> 1.7850416327921432 | L5: =(D5+F5+H5)/J5 -> 1.783670240017303
A6: FEB | C6: 71214.33 | D6: 95902.12 | E6: 445293.3 | F6: 442468.31 | G6: 0 | H6: 88605.41 | I6: =319114.53+10401.05 -> 329515.58 | J6: 440289.44 | K6: =SUM(C6+E6+G6)/I6 -> 1.5674755955393671 | L6: =(D6+F6+H6)/J6 -> 1.4240083523238711
A7: MAR | C7: 65418.239999999998 | D7: 90025.31 | E7: 446097.94 | F7: 442468.31 | G7: 0 | H7: 88605.41 | I7: =281337.98+9130.99 -> 290468.97 | J7: 392481.28000000003 | K7: =SUM(C7+E7+G7)/I7 -> 1.7610011148523026 | L7: =(D7+F7+H7)/J7 -> 1.5824933866909525
A8: APR | C8: 68472.3 | D8: 89732.35 | E8: 447261 | F8: 431010.97 | G8: 0 | H8: 0 | I8: =276914.67+9157.73 -> 286072.4 | J8: 363230.32 | K8: =SUM(C8+E8+G8)/I8 -> 1.8028069118167291 | L8: =(D8+F8+H8)/J8 -> 1.4336449666426523
A9: MAY | C9: 62377.52 | D9: 92684.6 | E9: 446176.36 | F9: 525919.69 | G9: 0 | H9: 0 | I9: =268624.45+10673.28 -> 279297.73 | J9: 400154.26 | K9: =SUM(C9+E9+G9)/I9 -> 1.8208306956164662 | L9: =(D9+F9+H9)/J9 -> 1.54591454305647
A10: JUN | C10: 117708.01 | D10: 130020.32 | E10: 443245.82 | F10: 525919.69 | G10: 0 | H10: 0 | I10: =476549.47+13926.79 -> 490476.26 | J10: 557413.99 | K10: =SUM(C10+E10+G10)/I10 -> 1.1436921126417006 | L10: =(D10+F10+H10)/J10 -> 1.1767555564940162
A11: JUL | C11: 129714.72 | D11: 208691.77 | E11: 440976.23 | F11: 592245.19 | G11: 27116 | H11: 51899.79 | I11: =590905.26+14642.56 -> 605547.82 | J11: 902553.8 | K11: =SUM(C11+E11+G11)/I11 -> 0.98721674862936493 | L11: =(D11+F11+H11)/J11 -> 0.94491513968474783
A12: AUG | C12: 130836.1 | D12: 152334.53 | E12: 433865.59 | F12: 592245.19 | G12: 27116 | H12: 51899.79 | I12: =589089.03+14461.03 -> 603550.06 | J12: 712983.57 | K12: =SUM(C12+E12+G12)/I12 -> 0.98056106563886347 | L12: =(D12+F12+H12)/J12 -> 1.1171078037604711
A13: SEP | C13: 137269.98 | D13: 166999.94 | E13: 434555.15 | F13: 592245.19 | G13: 27116 | H13: 51899.79 | I13: =640868.12+15090.81 -> 655958.93 | J13: 741913.64 | K13: =SUM(C13+E13+G13)/I13 -> 0.91307717999966853 | L13: =(D13+F13+H13)/J13 -> 1.0933144725577493
B15: Revenue: | C15: =SUM(C5:C13) -> 849769.65 | D15: =SUM(D5:D13) -> 1113495.73 | E15: =SUM(E5:E13) -> 3981158.59 | F15: =SUM(F5:F13) -> 4586990.85 | G15: =SUM(G5:G13) -> 81348 | H15: =SUM(H5:H13) -> 421515.6 | I15: - | J15: - | K15: =(C15+E15+G15) -> 4912276.24 | L15: =(D15+F15+H15) -> 6122002.1799999997
B16: Expense: | C16: - | D16: - | E16: - | F16: - | G16: - | H16: - | I16: =SUM(I5:I13) -> 3826845.03 | J16: =SUM(J5:J13) -> 4857596.98 | K16: =SUM(I16) -> 3826845.03 | L16: =SUM(J16) -> 4857596.98
B17: Net: | C17: - | D17: - | E17: - | F17: - | G17: - | H17: - | I17: - | J17: - | K17: =+K15-K16 -> 1085431.21 | L17: =+L15-L16 -> 1264405.2