A4: CLIENT: | C4: Mendik Realty Company
A7: ADDRESS: | C7: One Penn Plaza
C8: New York, N.Y.10019
A10: PREMISES: | C10: Common Area
A13: KW: | C13: 3606.8
A16: KWHR: | C16: 896886
A19: UTILITY RATE: | C19: Consolidated Edison SC-4 II Rate in effect May | H19: =+RatesFuelTax!D2 -> 2000
A22: ENERGY:
C23: On-Peak | D23: Kwhr: | E23: 688488 | F23: @ | G23: 6.0199999999999997E-2 | H23: =E23*G23 -> 41446.977599999998
C24: Off-Peak | D24: Kwhr: | E24: 208438 | F24: @ | G24: 4.3900000000000002E-2 | H24: =E24*G24 -> 9150.4282000000003
A26: DEMAND:
C27: KW: | E27: 3606.8 | F27: @ | G27: 18.96 | H27: =E27*G27 -> 68384.928
A29: FUEL ADJUSTMENT: | D29: Kwhr: | E29: 896886 | F29: @ | G29: =+RatesFuelTax!E12 -> 5.6999999999999998E-4 | H29: =E29*G29 -> 511.22501999999997
D31: Sub-Total | H31: =SUM(H23:H30) -> 119493.55881999999
A33: GROSS RECEIPT TAX: | E33: =+RatesFuelTax!F12 -> 6.8462999999999996E-2 | H33: =H31*E33 -> 8180.8875174936593
D35: Sub-Total | H35: =SUM(H31:H34) -> 127674.44633749365
A37: SALES TAX: | E37: 8.2500000000000004E-2 | H37: =H35*E37 -> 10533.141822843227
D38: TOTAL COST FOR
A39: CHARGE PER MONTH: | H39: =SUM(H34:H38) -> 138207.58816033686