B6: CLIENT: | D6: Mendik Realty Company
B8: ADDRESS: | D8: 888 7th Avenue
D9: New York,N.Y.10019
B11: PREMISES: | D11: =+RatesFuelTax!D2 -> 2000 | E11: Monthly Summary of Common Area Cost
B14: JANUARY | H14: =+JAN!H39 -> 61956.737750448679
B16: FEBRUARY | H16: =+FEB!H39 -> 69361.028379473602
B18: MARCH | H18: =+MAR!H39 -> 66166.146132454771
B20: APRIL | H20: =+APR!H39 -> 75260.250483343305
B22: MAY | H22: =+MAY!H39 -> 80505.512626206342
B24: JUNE | H24: =+JUN!H39 -> 163258.32744810346
B26: JULY | H26: =+JUL!H39 -> 172180.48825467698
B28: AUGUST | H28: =+AUG!H39 -> 183967.81106180337
B30: SEPTEMBER | H30: =+SEP!H39 -> 175349.15663426419
B32: OCTOBER | H32: =+OCT!H39 -> 87369.295740691305
B34: NOVEMBER | H34: =+NOV!H39 -> 100886.70536346562
B36: DECEMBER | H36: =+DEC!H39 -> 86978.260140984115
D38: TOTAL COST FOR | G38: =+RatesFuelTax!D2 -> 2000 | H38: =SUM(H14:H37) -> 1323239.7200159158