A4: CLIENT: | C4: Mendik Realty Company
A7: ADDRESS: | C7: 888 7th Avenue
C8: New York, N.Y.10019
A10: PREMISES: | C10: Common Area
A13: KW: | C13: 2344.39
A16: KWHR: | C16: 667710
A19: UTILITY RATE: | C19: Consolidated Edison SC-4 II Rate in effect August | H19: =+RatesFuelTax!D2 -> 2000
A22: ENERGY:
C23: On-Peak | D23: Kwhr: | E23: 485523 | F23: @ | G23: 0.11269999999999999 | H23: =E23*G23 -> 54718.4421
C24: Off-Peak | D24: Kwhr: | E24: 345009 | F24: @ | G24: 4.8500000000000001E-2 | H24: =E24*G24 -> 16732.9365
A26: DEMAND:
C27: KW: | E27: 2344.39 | F27: @ | G27: 31.29 | H27: =E27*G27 -> 73355.963099999994
A29: FUEL ADJUSTMENT: | D29: Kwhr: | E29: 667710 | F29: @ | G29: =+RatesFuelTax!E15 -> 2.1342E-2 | H29: =E29*G29 -> 14250.266820000001
D31: Sub-Total | H31: =SUM(H23:H30) -> 159057.60851999998
A33: GROSS RECEIPT TAX: | E33: =+RatesFuelTax!F15 -> 6.8462999999999996E-2 | H33: =H31*E33 -> 10889.561052104758
D35: Sub-Total | H35: =SUM(H31:H34) -> 169947.16957210473
A37: SALES TAX: | E37: 8.2500000000000004E-2 | H37: =H35*E37 -> 14020.641489698641
A39: CHARGE PER MONTH | H39: =SUM(H34:H38) -> 183967.81106180337