A4: CLIENT: | C4: Mendik Realty Company
A7: ADDRESS: | C7: 888 7th Avenue
C8: New York, N.Y.10019
A10: PREMISES: | C10: Common Area
A13: KW: | C13: 2047.23
A16: KWHR: | C16: 539343
A19: UTILITY RATE: | C19: Consolidated Edison SC-4 II Rate in effect April | H19: =+RatesFuelTax!D2 -> 2000
A22: ENERGY:
C23: On-Peak | D23: Kwhr: | E23: 417459 | F23: @ | G23: =+RatesFuelTax!B11 -> 4.58E-2 | H23: =E23*G23 -> 19119.622200000002
C24: Off-Peak | D24: Kwhr: | E24: 121884 | F24: @ | G24: =+RatesFuelTax!C11 -> 3.6299999999999999E-2 | H24: =E24*G24 -> 4424.3891999999996
A26: DEMAND:
C27: KW: | E27: 2047.23 | F27: @ | G27: =+RatesFuelTax!D11 -> 15.67 | H27: =E27*G27 -> 32080.094099999998
A29: FUEL ADJUSTMENT: | D29: Kwhr: | E29: 539343 | F29: @ | G29: =+RatesFuelTax!E11 -> 1.7513000000000001E-2 | H29: =E29*G29 -> 9445.5139589999999
D31: Sub-Total | H31: =SUM(H23:H30) -> 65069.619459000009
A33: GROSS RECEIPT TAX: | E33: =+RatesFuelTax!F11 -> 6.8462999999999996E-2 | H33: =H31*E33 -> 4454.8613570215175
D35: Sub-Total | H35: =SUM(H31:H34) -> 69524.480816021533
A37: SALES TAX: | E37: 8.2500000000000004E-2 | H37: =H35*E37 -> 5735.769667321777
A39: CHARGE PER MONTH: | H39: =SUM(H34:H38) -> 75260.250483343305