A4: CLIENT: | C4: Mendik Realty Company
A7: ADDRESS: | C7: 888 7th Avenue
C8: New York, N.Y.10019
A10: PREMISES: | C10: Common Area
A13: KW: | C13: 1659.39
A16: KWHR: | C16: 488019
A19: UTILITY RATE: | C19: Consolidated Edison SC-4 II Rate in effect December | H19: =+RatesFuelTax!D2 -> 2000
A22: ENERGY:
C23: On-Peak | D23: Kwhr: | E23: 345009 | F23: @ | G23: =+RatesFuelTax!B19 -> 9.3899999999999997E-2 | H23: =E23*G23 -> 32396.345099999999
C24: Off-Peak | D24: Kwhr: | E24: 143010 | F24: @ | G24: =+RatesFuelTax!C19 -> 5.4100000000000002E-2 | H24: =E24*G24 -> 7736.8410000000003
A26: DEMAND:
C27: KW: | E27: 1659.39 | F27: @ | G27: =+RatesFuelTax!D19 -> 20.91 | H27: =E27*G27 -> 34697.844900000004
A29: FUEL ADJUSTMENT: | D29: Kwhr: | E29: 488019 | F29: @ | G29: =+RatesFuelTax!E19 -> 7.5799999999999999E-4 | H29: =E29*G29 -> 369.91840200000001
D31: Sub-Total | H31: =SUM(H23:H30) -> 75200.949401999998
A33: GROSS RECEIPT TAX: | E33: =+RatesFuelTax!F19 -> 6.8462999999999996E-2 | H33: =H31*E33 -> 5148.482598909126
D35: Sub-Total | H35: =SUM(H31:H34) -> 80349.432000909117
A37: SALES TAX: | E37: 8.2500000000000004E-2 | H37: =H35*E37 -> 6628.8281400750029
A39: CHARGE PER MONTH: | H39: =SUM(H34:H38) -> 86978.260140984115