A4: CLIENT: | C4: Mendik Realty Company
A7: ADDRESS: | C7: 888 7th Avenue
C8: New York, N.Y.10019
A10: PREMISES: | C10: Common Area
A13: KW: | C13: 2047.23
A16: KWHR: | C16: 539343
A19: UTILITY RATE: | C19: Consolidated Edison SC-4 II Rate in effect November | H19: =+RatesFuelTax!D2 -> 2000
A22: ENERGY:
C23: On-Peak | D23: Kwhr: | E23: 417459 | F23: @ | G23: =+RatesFuelTax!B18 -> 9.3899999999999997E-2 | H23: =E23*G23 -> 39199.400099999999
C24: Off-Peak | D24: Kwhr: | E24: 121884 | F24: @ | G24: =+RatesFuelTax!C18 -> 5.4100000000000002E-2 | H24: =E24*G24 -> 6593.9243999999999
A26: DEMAND:
C27: KW: | E27: 2047.23 | F27: @ | G27: =+RatesFuelTax!D18 -> 20.91 | H27: =E27*G27 -> 42807.579299999998
A29: FUEL ADJUSTMENT: | D29: Kwhr: | E29: 539343 | F29: @ | G29: =+RatesFuelTax!E18 -> -2.5490000000000001E-3 | H29: =E29*G29 -> -1374.7853070000001
D31: Sub-Total | H31: =SUM(H23:H30) -> 87226.118493000002
A33: GROSS RECEIPT TAX: | E33: =+RatesFuelTax!F18 -> 6.8462999999999996E-2 | H33: =H31*E33 -> 5971.7617503862584
D35: Sub-Total | H35: =SUM(H31:H34) -> 93197.880243386258
A37: SALES TAX: | E37: 8.2500000000000004E-2 | H37: =H35*E37 -> 7688.8251200793666
A39: CHARGE PER MONTH: | H39: =SUM(H34:H38) -> 100886.70536346562