A4: CLIENT: | C4: Mendik Realty Company
A7: ADDRESS: | C7: 888 7th Avenue
C8: New York, N.Y.10019
A10: PREMISES: | C10: Common Area
A13: KW: | C13: 2047.23
A16: KWHR: | C16: 539343
A19: UTILITY RATE: | C19: Consolidated Edison SC-4 II Rate in effect May | H19: =+RatesFuelTax!D2 -> 2000
A22: ENERGY:
C23: On-Peak | D23: Kwhr: | E23: 417459 | F23: @ | G23: 6.0199999999999997E-2 | H23: =E23*G23 -> 25131.031799999997
C24: Off-Peak | D24: Kwhr: | E24: 121884 | F24: @ | G24: 4.3900000000000002E-2 | H24: =E24*G24 -> 5350.7076000000006
A26: DEMAND:
C27: KW: | E27: 2047.23 | F27: @ | G27: 18.96 | H27: =E27*G27 -> 38815.480800000005
A29: FUEL ADJUSTMENT: | D29: Kwhr: | E29: 539343 | F29: @ | G29: =+RatesFuelTax!E12 -> 5.6999999999999998E-4 | H29: =E29*G29 -> 307.42550999999997
D31: Sub-Total | H31: =SUM(H23:H30) -> 69604.645710000012
A33: GROSS RECEIPT TAX: | E33: =+RatesFuelTax!F12 -> 6.8462999999999996E-2 | H33: =H31*E33 -> 4765.3428592437303
D35: Sub-Total | H35: =SUM(H31:H34) -> 74369.988569243738
A37: SALES TAX: | E37: 8.2500000000000004E-2 | H37: =H35*E37 -> 6135.5240569626085
A39: CHARGE PER MONTH: | H39: =SUM(H34:H38) -> 80505.512626206342