A4: CLIENT: | C4: Mendik Realty Company
A7: ADDRESS: | C7: 888 7th Avenue
C8: New York, N.Y.10019
A10: PREMISES: | C10: Common Area
A13: KW: | C13: 1659.39
A16: KWHR: | C16: 488019
A19: UTILITY RATE: | C19: Consolidated Edison SC-4 II Rate in effect March | H19: =+RatesFuelTax!D2 -> 2000
A22: ENERGY:
C23: On-Peak | D23: Kwhr: | E23: 345009 | F23: @ | G23: =+RatesFuelTax!B10 -> 4.58E-2 | H23: =E23*G23 -> 15801.412200000001
C24: Off-Peak | D24: Kwhr: | E24: 143010 | F24: @ | G24: =+RatesFuelTax!C10 -> 3.6299999999999999E-2 | H24: =E24*G24 -> 5191.2629999999999
A26: DEMAND:
C27: KW: | E27: 1659.39 | F27: @ | G27: =+RatesFuelTax!D10 -> 15.67 | H27: =E27*G27 -> 26002.641300000003
A29: FUEL ADJUSTMENT: | D29: Kwhr: | E29: 488019 | F29: @ | G29: =+RatesFuelTax!E10 -> 2.0899999999999998E-2 | H29: =E29*G29 -> 10199.597099999999
D31: Sub-Total | H31: =SUM(H23:H30) -> 57194.9136
A33: GROSS RECEIPT TAX: | E33: =+RatesFuelTax!F10 -> 6.8686999999999998E-2 | H33: =H31*E33 -> 3928.5470304431997
D35: Sub-Total | H35: =SUM(H31:H34) -> 61123.460630443202
A37: SALES TAX: | E37: 8.2500000000000004E-2 | H37: =H35*E37 -> 5042.6855020115645
A39: CHARGE PER MONTH: | H39: =SUM(H34:H38) -> 66166.146132454771