B6: CLIENT: | D6: Mendik Realty Company
B8: ADDRESS: | D8: 150 East 58 Street
D9: New York,N.Y.10022
B11: PREMISES: | D11: =+RatesFuelTax!D2 -> 2000 | E11: Monthly Summary of Common Area Cost
B14: JANUARY | H14: =+JAN!H39 -> 24151.41743078834
B16: FEBRUARY | H16: =+FEB!H39 -> 26956.745373566606
B18: MARCH | H18: =+MAR!H39 -> 25746.272569282795
B20: APRIL | H20: =+APR!H39 -> 25016.54102425891
B22: MAY | H22: =+MAY!H39 -> 26554.22114432148
B24: JUNE | H24: =+JUN!H39 -> 42760.37699679831
B26: JULY | H26: =+JUL!H39 -> 45231.071659354588
B28: AUGUST | H28: =+AUG!H39 -> 48495.1773145607
B30: SEPTEMBER | H30: =+SEP!H39 -> 46108.528614298608
B32: OCTOBER | H32: =+OCT!H39 -> 28907.34500637955
B34: NOVEMBER | H34: =+NOV!H39 -> 32999.080574819163
B36: DECEMBER | H36: =+DEC!H39 -> 33706.307031070661
D38: TOTAL COST FOR | G38: =+RatesFuelTax!D2 -> 2000 | H38: =SUM(H14:H37) -> 406633.08473949967