A4: CLIENT: | C4: Mendik Realty Company
A7: ADDRESS: | C7: 150 East 58 Street
C8: New York, N.Y.10022
A10: PREMISES: | C10: Common Area
A13: KW: | C13: 669
A16: KWHR: | C16: 184900
A19: UTILITY RATE: | C19: Consolidated Edison SC-4 II Rate in effect July | H19: =+RatesFuelTax!D2 -> 2000
A22: ENERGY:
C23: On-Peak | D23: Kwhr: | E23: 125886 | F23: @ | G23: 0.11269999999999999 | H23: =E23*G23 -> 14187.352199999999
C24: Off-Peak | D24: Kwhr: | E24: 59014 | F24: @ | G24: 4.8500000000000001E-2 | H24: =E24*G24 -> 2862.1790000000001
A26: DEMAND:
C27: KW: | E27: 669 | F27: @ | G27: 31.29 | H27: =E27*G27 -> 20933.01
A29: FUEL ADJUSTMENT: | D29: Kwhr: | E29: 184900 | F29: @ | G29: =+RatesFuelTax!E14 -> 6.0790000000000002E-3 | H29: =E29*G29 -> 1124.0071
D31: Sub-Total | H31: =SUM(H23:H30) -> 39106.548299999995
A33: GROSS RECEIPT TAX: | E33: =+RatesFuelTax!F14 -> 6.8462999999999996E-2 | H33: =H31*E33 -> 2677.3516162628994
D35: Sub-Total | H35: =SUM(H31:H34) -> 41783.899916262897
A37: SALES TAX: | E37: 8.2500000000000004E-2 | H37: =H35*E37 -> 3447.1717430916892
A39: CHARGE PER MONTH | H39: =SUM(H34:H38) -> 45231.071659354588