A4: CLIENT: | C4: Mendik Realty Company
A7: ADDRESS: | C7: 150 East 58 Street
C8: New York, N.Y.10022
A10: PREMISES: | C10: Common Area
A13: KW: | C13: 669
A16: KWHR: | C16: 184900
A19: UTILITY RATE: | C19: Consolidated Edison SC-4 II Rate in effect March | H19: =+RatesFuelTax!D2 -> 2000
A22: ENERGY:
C23: On-Peak | D23: Kwhr: | E23: 125886 | F23: @ | G23: =+RatesFuelTax!B10 -> 4.58E-2 | H23: =E23*G23 -> 5765.5788000000002
C24: Off-Peak | D24: Kwhr: | E24: 59014 | F24: @ | G24: =+RatesFuelTax!C10 -> 3.6299999999999999E-2 | H24: =E24*G24 -> 2142.2082
A26: DEMAND:
C27: KW: | E27: 669 | F27: @ | G27: =+RatesFuelTax!D10 -> 15.67 | H27: =E27*G27 -> 10483.23
A29: FUEL ADJUSTMENT: | D29: Kwhr: | E29: 184900 | F29: @ | G29: =+RatesFuelTax!E10 -> 2.0899999999999998E-2 | H29: =E29*G29 -> 3864.41
D31: Sub-Total | H31: =SUM(H23:H30) -> 22255.427
A33: GROSS RECEIPT TAX: | E33: =+RatesFuelTax!F10 -> 6.8686999999999998E-2 | H33: =H31*E33 -> 1528.6585143489999
D35: Sub-Total | H35: =SUM(H31:H34) -> 23784.085514349001
A37: SALES TAX: | E37: 8.2500000000000004E-2 | H37: =H35*E37 -> 1962.1870549337928
A39: CHARGE PER MONTH: | H39: =SUM(H34:H38) -> 25746.272569282795