A1: HOME
A4: CLIENT: | C4: Mendik Realty Company
A7: ADDRESS: | C7: 1740 Broadway
C8: New York, N.Y.10019
A10: PREMISES: | C10: Common Area
A13: KW: | C13: 642.9
A16: KWHR: | C16: 182751
A19: UTILITY RATE: | C19: Consolidated Edison SC-4 II Rate in effect October | H19: =+RatesFuelTax!D2 -> 2000
A22: ENERGY:
C23: On-Peak | D23: Kwhr: | E23: 126400 | F23: @ | G23: 6.0199999999999997E-2 | H23: =E23*G23 -> 7609.28
C24: Off-Peak | D24: Kwhr: | E24: 56351 | F24: @ | G24: 4.3900000000000002E-2 | H24: =E24*G24 -> 2473.8089
A26: DEMAND:
C27: KW: | E27: 642.9 | F27: @ | G27: 18.96 | H27: =E27*G27 -> 12189.384
A29: FUEL ADJUSTMENT: | D29: Kwhr: | E29: 182751 | F29: @ | G29: =+RatesFuelTax!E17 -> 1.1573E-2 | H29: =E29*G29 -> 2114.9773230000001
D31: Sub-Total | H31: =SUM(H23:H30) -> 24387.450223
A33: GROSS RECEIPT TAX: | E33: =+RatesFuelTax!F17 -> 6.8462999999999996E-2 | H33: =H31*E33 -> 1669.638004617249
D35: Sub-Total | H35: =SUM(H31:H34) -> 26057.088227617249
A37: SALES TAX: | E37: 8.2500000000000004E-2 | H37: =H35*E37 -> 2149.7097787784232
A39: CHARGE PER MONTH: | H39: =SUM(H34:H38) -> 28206.798006395671