A1: HOME
A4: CLIENT: | C4: Mendik Realty Company
A7: ADDRESS: | C7: 1740 Broadway
C8: New York, N.Y.10019
A10: PREMISES: | C10: Common Area
A13: KW: | C13: 642.9
A16: KWHR: | C16: 182751
A19: UTILITY RATE: | C19: Consolidated Edison SC-4 II Rate in effect December | H19: =+RatesFuelTax!D2 -> 2000
A22: ENERGY:
C23: On-Peak | D23: Kwhr: | E23: 126400 | F23: @ | G23: =+RatesFuelTax!B19 -> 9.3899999999999997E-2 | H23: =E23*G23 -> 11868.96
C24: Off-Peak | D24: Kwhr: | E24: 56351 | F24: @ | G24: =+RatesFuelTax!C19 -> 5.4100000000000002E-2 | H24: =E24*G24 -> 3048.5891000000001
A26: DEMAND:
C27: KW: | E27: 642.9 | F27: @ | G27: =+RatesFuelTax!D19 -> 20.91 | H27: =E27*G27 -> 13443.038999999999
A29: FUEL ADJUSTMENT: | D29: Kwhr: | E29: 182751 | F29: @ | G29: =+RatesFuelTax!E19 -> 7.5799999999999999E-4 | H29: =E29*G29 -> 138.52525800000001
D31: Sub-Total | H31: =SUM(H23:H30) -> 28499.113358000002
A33: GROSS RECEIPT TAX: | E33: =+RatesFuelTax!F19 -> 6.8462999999999996E-2 | H33: =H31*E33 -> 1951.134797828754
D35: Sub-Total | H35: =SUM(H31:H34) -> 30450.248155828755
A37: SALES TAX: | E37: 8.2500000000000004E-2 | H37: =H35*E37 -> 2512.1454728558724
A39: CHARGE PER MONTH: | H39: =SUM(H34:H38) -> 32962.393628684629