A1: HOME
B6: CLIENT: | D6: Mendik Realty Company
B8: ADDRESS: | D8: 1740 Broadway
D9: New York,N.Y.10019
B11: PREMISES: | D11: =+RatesFuelTax!D2 -> 2000 | E11: Monthly Summary of Common Area Cost
B14: JANUARY | H14: =+JAN!H39 -> 23560.260740758058
B16: FEBRUARY | H16: =+FEB!H39 -> 26332.983763314427
B18: MARCH | H18: =+MAR!H39 -> 25136.579677561742
B20: APRIL | H20: =+APR!H39 -> 24415.394509124952
B22: MAY | H22: =+MAY!H39 -> 25881.073508339265
B24: JUNE | H24: =+JUN!H39 -> 58750.90578671368
B26: JULY | H26: =+JUL!H39 -> 62081.038736486254
B28: AUGUST | H28: =+AUG!H39 -> 66480.572988401662
B30: SEPTEMBER | H30: =+SEP!H39 -> 63263.721632090586
B32: OCTOBER | H32: =+OCT!H39 -> 28206.798006395671
B34: NOVEMBER | H34: =+NOV!H39 -> 32263.386910964684
B36: DECEMBER | H36: =+DEC!H39 -> 32962.393628684629
D38: TOTAL COST FOR | G38: =+RatesFuelTax!D2 -> 2000 | H38: =SUM(H14:H37) -> 469335.10988883564