A1: HOME
A4: CLIENT: | C4: Mendik Realty Company
A7: ADDRESS: | C7: 1740 Broadway
C8: New York, N.Y.10019
A10: PREMISES: | C10: Common Area
A13: KW: | C13: 898.4
A16: KWHR: | C16: 249218
A19: UTILITY RATE: | C19: Consolidated Edison SC-4 II Rate in effect July | H19: =+RatesFuelTax!D2 -> 2000
A22: ENERGY:
C23: On-Peak | D23: Kwhr: | E23: 186323 | F23: @ | G23: 0.11269999999999999 | H23: =E23*G23 -> 20998.6021
C24: Off-Peak | D24: Kwhr: | E24: 62895 | F24: @ | G24: 4.8500000000000001E-2 | H24: =E24*G24 -> 3050.4075000000003
A26: DEMAND:
C27: KW: | E27: 898.4 | F27: @ | G27: 31.29 | H27: =E27*G27 -> 28110.935999999998
A29: FUEL ADJUSTMENT: | D29: Kwhr: | E29: 249218 | F29: @ | G29: =+RatesFuelTax!E14 -> 6.0790000000000002E-3 | H29: =E29*G29 -> 1514.996222
D31: Sub-Total | H31: =SUM(H23:H30) -> 53674.941822000001
A33: GROSS RECEIPT TAX: | E33: =+RatesFuelTax!F14 -> 6.8462999999999996E-2 | H33: =H31*E33 -> 3674.7475419595858
D35: Sub-Total | H35: =SUM(H31:H34) -> 57349.689363959587
A37: SALES TAX: | E37: 8.2500000000000004E-2 | H37: =H35*E37 -> 4731.3493725266662
A39: CHARGE PER MONTH | H39: =SUM(H34:H38) -> 62081.038736486254