A4: CLIENT: | C4: Mendik Realty Company
A7: ADDRESS: | C7: 866 U.N. Plaza
C8: New York, N.Y.10017
A10: PREMISES: | C10: Common Area
A13: KW: | C13: 612.29
A16: KWHR: | C16: 185694
A19: UTILITY RATE: | C19: Consolidated Edison SC-4 II Rate in effect June | H19: =+RatesFuelTax!D2 -> 2000
A22: ENERGY:
C23: On-Peak | D23: Kwhr: | E23: 125694 | F23: @ | G23: 0.11269999999999999 | H23: =E23*G23 -> 14165.7138
C24: Off-Peak | D24: Kwhr: | E24: 60000 | F24: @ | G24: 4.8500000000000001E-2 | H24: =E24*G24 -> 2910
A26: DEMAND:
C27: KW: | E27: 612.29 | F27: @ | G27: 31.29 | H27: =E27*G27 -> 19158.554099999998
A29: FUEL ADJUSTMENT: | D29: Kwhr: | E29: 185694 | F29: @ | G29: =+RatesFuelTax!E13 -> -5.4739999999999997E-3 | H29: =E29*G29 -> -1016.4889559999999
D31: Sub-Total | H31: =SUM(H23:H30) -> 35217.778943999991
A33: GROSS RECEIPT TAX: | E33: =+RatesFuelTax!F13 -> 6.8462999999999996E-2 | H33: =H31*E33 -> 2411.1147998430711
D35: Sub-Total | H35: =SUM(H31:H34) -> 37628.893743843058
A37: SALES TAX: | E37: 8.2500000000000004E-2 | H37: =H35*E37 -> 3104.3837338670523
A39: CHARGE PER MONTH | H39: =SUM(H34:H38) -> 40733.277477710108