A4: CLIENT: | C4: Mendik Realty Company
A7: ADDRESS: | C7: 866 U.N. Plaza
C8: New York, N.Y.10017
A10: PREMISES: | C10: Common Area
A13: KW: | C13: 612.29
A16: KWHR: | C16: 185694
A19: UTILITY RATE: | C19: Consolidated Edison SC-4 II Rate in effect January | H19: =+RatesFuelTax!D2 -> 2000
A22: ENERGY:
C23: On-Peak | D23: Kwhr: | E23: 125694 | F23: @ | G23: =+RatesFuelTax!B8 -> 4.58E-2 | H23: =E23*G23 -> 5756.7852000000003
C24: Off-Peak | D24: Kwhr: | E24: 60000 | F24: @ | G24: =+RatesFuelTax!C8 -> 3.6299999999999999E-2 | H24: =E24*G24 -> 2178
A26: DEMAND:
C27: KW: | E27: 612.29 | F27: @ | G27: =+RatesFuelTax!D8:D8 -> 15.67 | H27: =E27*G27 -> 9594.5842999999986
A29: FUEL ADJUSTMENT: | D29: Kwhr: | E29: 185694 | F29: @ | G29: =+RatesFuelTax!E8 -> 1.3443999999999999E-2 | H29: =E29*G29 -> 2496.4701359999999
D31: Sub-Total | H31: =SUM(H23:H30) -> 20025.839636000001
A33: GROSS RECEIPT TAX: | E33: =+RatesFuelTax!F8 -> 6.8686999999999998E-2 | H33: =H31*E33 -> 1375.514847077932
D35: Sub-Total | H35: =SUM(H31:H34) -> 21401.354483077932
A37: SALES TAX: | E37: 8.2500000000000004E-2 | H37: =H35*E37 -> 1765.6117448539294
A39: CHARGE PER MONTH: | H39: =SUM(H34:H38) -> 23166.966227931862