B6: CLIENT: | D6: Mendik Realty Company
B8: ADDRESS: | D8: 866 U.N. Plaza
D9: New York,N.Y.10017
B11: PREMISES: | D11: =+RatesFuelTax!D2 -> 2000 | E11: Monthly Summary of Common Area Cost
B14: JANUARY | H14: =+JAN!H39 -> 23166.966227931862
B16: FEBRUARY | H16: =+FEB!H39 -> 25984.340846678577
B18: MARCH | H18: =+MAR!H39 -> 24768.670014235755
B20: APRIL | H20: =+APR!H39 -> 24036.032928591078
B22: MAY | H22: =+MAY!H39 -> 25347.877839758032
B24: JUNE | H24: =+JUN!H39 -> 40733.277477710108
B26: JULY | H26: =+JUL!H39 -> 43214.581829623174
B28: AUGUST | H28: =+AUG!H39 -> 46492.704250054994
B30: SEPTEMBER | H30: =+SEP!H39 -> 44095.806771707408
B32: OCTOBER | H32: =+OCT!H39 -> 27711.055523831368
B34: NOVEMBER | H34: =+NOV!H39 -> 31666.067425659341
B36: DECEMBER | H36: =+DEC!H39 -> 32376.33086301557
D38: TOTAL COST FOR | G38: =+RatesFuelTax!D2 -> 2000 | H38: =SUM(H14:H37) -> 389593.71199879725