A4: CLIENT: | C4: Mendik Realty Company
A7: ADDRESS: | C7: 866 U.N. Plaza
C8: New York, N.Y.10017
A10: PREMISES: | C10: Common Area
A13: KW: | C13: 612.29
A16: KWHR: | C16: 185694
A19: UTILITY RATE: | C19: Consolidated Edison SC-4 II Rate in effect October | H19: =+RatesFuelTax!D2 -> 2000
A22: ENERGY:
C23: On-Peak | D23: Kwhr: | E23: 125694 | F23: @ | G23: 6.0199999999999997E-2 | H23: =E23*G23 -> 7566.7787999999991
C24: Off-Peak | D24: Kwhr: | E24: 60000 | F24: @ | G24: 4.3900000000000002E-2 | H24: =E24*G24 -> 2634
A26: DEMAND:
C27: KW: | E27: 612.29 | F27: @ | G27: 18.96 | H27: =E27*G27 -> 11609.018399999999
A29: FUEL ADJUSTMENT: | D29: Kwhr: | E29: 185694 | F29: @ | G29: =+RatesFuelTax!E17 -> 1.1573E-2 | H29: =E29*G29 -> 2149.036662
D31: Sub-Total | H31: =SUM(H23:H30) -> 23958.833861999999
A33: GROSS RECEIPT TAX: | E33: =+RatesFuelTax!F17 -> 6.8462999999999996E-2 | H33: =H31*E33 -> 1640.293642694106
D35: Sub-Total | H35: =SUM(H31:H34) -> 25599.127504694105
A37: SALES TAX: | E37: 8.2500000000000004E-2 | H37: =H35*E37 -> 2111.9280191372636
A39: CHARGE PER MONTH: | H39: =SUM(H34:H38) -> 27711.055523831368