A2: Home
A4: CLIENT: | C4: Trizechahn Office Properties
A7: ADDRESS: | C7: 1411 Broadway
C8: New York, N.Y.10018
A10: PREMISES: | C10: Common Area
A13: KW: | C13: 2064.61
A16: KWHR: | C16: 606350
A19: UTILITY RATE: | C19: Consolidated Edison SC-4 II Rate in effect November | H19: =+RatesFuelTax!D2 -> 2000
A22: ENERGY:
C23: On-Peak | D23: Kwhr: | E23: 383617 | F23: @ | G23: =+RatesFuelTax!B18 -> 9.3850000000000003E-2 | H23: =E23*G23 -> 36002.455450000001
C24: Off-Peak | D24: Kwhr: | E24: 222733 | F24: @ | G24: =+RatesFuelTax!C18 -> 5.4100000000000002E-2 | H24: =E24*G24 -> 12049.855300000001
A26: DEMAND:
C27: KW: | E27: 2064.61 | F27: @ | G27: =+RatesFuelTax!D18 -> 20.91 | H27: =E27*G27 -> 43170.9951
A29: FUEL ADJUSTMENT: | D29: Kwhr: | E29: 606350 | F29: @ | G29: =+RatesFuelTax!E18 -> -2.5490000000000001E-3 | H29: =E29*G29 -> -1545.5861500000001
D31: Sub-Total | H31: =SUM(H23:H30) -> 89677.719700000001
A33: GROSS RECEIPT TAX: | E33: =+RatesFuelTax!F18 -> 6.8462999999999996E-2 | H33: =H31*E33 -> 6139.6057238210997
D35: Sub-Total | H35: =SUM(H31:H34) -> 95817.325423821108
A37: SALES TAX: | E37: 8.2500000000000004E-2 | H37: =H35*E37 -> 7904.9293474652422
A39: CHARGE PER MONTH: | H39: =SUM(H34:H38) -> 103722.25477128635