A2: Home
A4: CLIENT: | C4: Trizechahn Office Properties
A7: ADDRESS: | C7: 1411 Broadway
C8: New York, N.Y.10018
A10: PREMISES: | C10: Common Area
A13: KW: | C13: 2064.61
A16: KWHR: | C16: 606350
A19: UTILITY RATE: | C19: Consolidated Edison SC-4 II Rate in effect October | H19: =+RatesFuelTax!D2 -> 2000
A22: ENERGY:
C23: On-Peak | D23: Kwhr: | E23: 383617 | F23: @ | G23: 6.0199999999999997E-2 | H23: =E23*G23 -> 23093.743399999999
C24: Off-Peak | D24: Kwhr: | E24: 222733 | F24: @ | G24: 4.3900000000000002E-2 | H24: =E24*G24 -> 9777.9786999999997
A26: DEMAND:
C27: KW: | E27: 2064.61 | F27: @ | G27: 18.96 | H27: =E27*G27 -> 39145.005600000004
A29: FUEL ADJUSTMENT: | D29: Kwhr: | E29: 606350 | F29: @ | G29: =+RatesFuelTax!E17 -> 1.1573E-2 | H29: =E29*G29 -> 7017.2885500000002
D31: Sub-Total | H31: =SUM(H23:H30) -> 79034.016250000001
A33: GROSS RECEIPT TAX: | E33: =+RatesFuelTax!F17 -> 6.8462999999999996E-2 | H33: =H31*E33 -> 5410.9058545237494
D35: Sub-Total | H35: =SUM(H31:H34) -> 84444.92210452375
A37: SALES TAX: | E37: 8.2500000000000004E-2 | H37: =H35*E37 -> 6966.7060736232097
A39: CHARGE PER MONTH: | H39: =SUM(H34:H38) -> 91411.628178146959