A2: Home
A4: CLIENT: | C4: Trizechahn Office Properties
A7: ADDRESS: | C7: 1411 Broadway
C8: New York, N.Y.10018
A10: PREMISES: | C10: Common Area
A13: KW: | C13: 2064.61
A16: KWHR: | C16: 606350
A19: UTILITY RATE: | C19: Consolidated Edison SC-4 II Rate in effect February | H19: =+RatesFuelTax!D2 -> 2000
A22: ENERGY:
C23: On-Peak | D23: Kwhr: | E23: 383617 | F23: @ | G23: =+RatesFuelTax!B9 -> 4.58E-2 | H23: =E23*G23 -> 17569.658599999999
C24: Off-Peak | D24: Kwhr: | E24: 222733 | F24: @ | G24: =+RatesFuelTax!C9 -> 3.6299999999999999E-2 | H24: =E24*G24 -> 8085.2078999999994
A26: DEMAND:
C27: KW: | E27: 2064.61 | F27: @ | G27: =+RatesFuelTax!D9 -> 15.67 | H27: =E27*G27 -> 32352.438700000002
A29: FUEL ADJUSTMENT: | D29: Kwhr: | E29: 606350 | F29: @ | G29: =+RatesFuelTax!E9 -> 2.6558999999999999E-2 | H29: =E29*G29 -> 16104.049649999999
D31: Sub-Total | H31: =SUM(H23:H30) -> 74111.354850000003
A33: GROSS RECEIPT TAX: | E33: =+RatesFuelTax!F9 -> 6.8686999999999998E-2 | H33: =H31*E33 -> 5090.4866305819505
D35: Sub-Total | H35: =SUM(H31:H34) -> 79201.841480581948
A37: SALES TAX: | E37: 8.2500000000000004E-2 | H37: =H35*E37 -> 6534.1519221480112
A39: CHARGE PER MONTH: | H39: =SUM(H34:H38) -> 85735.993402729961