A2: Home
A4: CLIENT: | C4: Trizechahn Office Properties
A7: ADDRESS: | C7: 1411 Broadway
C8: New York, N.Y.10018
A10: PREMISES: | C10: Common Area
A13: KW: | C13: 2491.62
A16: KWHR: | C16: 754962
A19: UTILITY RATE: | C19: Consolidated Edison SC-4 II Rate in effect July | H19: =+RatesFuelTax!D2 -> 2000
A22: ENERGY:
C23: On-Peak | D23: Kwhr: | E23: 466777 | F23: @ | G23: 0.11269999999999999 | H23: =E23*G23 -> 52605.767899999999
C24: Off-Peak | D24: Kwhr: | E24: 288185 | F24: @ | G24: 4.8500000000000001E-2 | H24: =E24*G24 -> 13976.9725
A26: DEMAND:
C27: KW: | E27: 2491.62 | F27: @ | G27: 31.29 | H27: =E27*G27 -> 77962.789799999999
A29: FUEL ADJUSTMENT: | D29: Kwhr: | E29: 754962 | F29: @ | G29: =+RatesFuelTax!E14 -> 6.0790000000000002E-3 | H29: =E29*G29 -> 4589.413998
D31: Sub-Total | H31: =SUM(H23:H30) -> 149134.94419799998
A33: GROSS RECEIPT TAX: | E33: =+RatesFuelTax!F14 -> 6.8462999999999996E-2 | H33: =H31*E33 -> 10210.225684627672
D35: Sub-Total | H35: =SUM(H31:H34) -> 159345.16988262767
A37: SALES TAX: | E37: 8.2500000000000004E-2 | H37: =H35*E37 -> 13145.976515316783
A39: CHARGE PER MONTH | H39: =SUM(H34:H38) -> 172491.14639794445