A4: Home
A6: CLIENT: | C6: Trizechahn Office Properties
A9: ADDRESS: | C9: 1411 Broadway
C10: New York, N.Y.10018
B12: PREMISES: | D12: =+RatesFuelTax!D2 -> 2000 | E12: Monthly Summary of Common Area Cost
B15: JANUARY | H15: =+JAN!H39 -> 76536.368751006841
B17: FEBRUARY | H17: =+FEB!H39 -> 85735.993402729961
B19: MARCH | H19: =+MAR!H39 -> 81766.441294144286
B21: APRIL | H21: =+APR!H39 -> 79373.961769787013
B23: MAY | H23: =+MAY!H39 -> 83695.101048902783
B25: JUNE | H25: =+JUN!H39 -> 162403.09564709099
B27: JULY | H27: =+JUL!H39 -> 172491.14639794445
B29: AUGUST | H29: =+AUG!H39 -> 185818.75988450865
B31: SEPTEMBER | H31: =+SEP!H39 -> 176073.87575228975
B33: OCTOBER | H33: =+OCT!H39 -> 91411.628178146959
B35: NOVEMBER | H35: =+NOV!H39 -> 103722.25477128635
B37: DECEMBER | H37: =+DEC!H39 -> 106041.49090837718
D39: TOTAL COST FOR | G39: =+RatesFuelTax!D2 -> 2000 | H39: =SUM(H15:H38) -> 1405070.1178062151