A4: CLIENT: | C4: American Airlines T9
A7: ADDRESS: | C7: TERMINAL 9 JFK INTL AIRPORT ATTN: SHAWN SAGIVJAMAICA, NY 11430
C8: New York, N.Y.10019
A10: PREMISES: | C10: Common Area
A13: KW: | C13: 3606.8
A16: KWHR: | C16: 896886
A19: UTILITY RATE: | C19: Consolidated Edison SC-4 II Rate in effect November | H19: =+RatesFuelTax!D2 -> 2001
A22: ENERGY:
C23: On-Peak | D23: Kwhr: | E23: 688488 | F23: @ | G23: =+RatesFuelTax!B18 -> 9.3899999999999997E-2 | H23: =E23*G23 -> 64649.023199999996
C24: Off-Peak | D24: Kwhr: | E24: 208438 | F24: @ | G24: =+RatesFuelTax!C18 -> 5.4100000000000002E-2 | H24: =E24*G24 -> 11276.495800000001
A26: DEMAND:
C27: KW: | E27: 3606.8 | F27: @ | G27: =+RatesFuelTax!D18 -> 20.91 | H27: =E27*G27 -> 75418.188000000009
A29: FUEL ADJUSTMENT: | D29: Kwhr: | E29: 896886 | F29: @ | G29: =+RatesFuelTax!E18 -> -2.5490000000000001E-3 | H29: =E29*G29 -> -2286.1624139999999
D31: Sub-Total | H31: =SUM(H23:H30) -> 149057.544586
A33: GROSS RECEIPT TAX: | E33: =+RatesFuelTax!F18 -> 6.8462999999999996E-2 | H33: =H31*E33 -> 10204.926674991317
D35: Sub-Total | H35: =SUM(H31:H34) -> 159262.47126099133
A37: SALES TAX: | E37: 8.2500000000000004E-2 | H37: =H35*E37 -> 13139.153879031785
D38: TOTAL COST FOR
A39: CHARGE PER MONTH: | H39: =SUM(H34:H38) -> 172401.6251400231