A4: CLIENT: | C4: Demo Company
A7: ADDRESS: | C7: Demo Building
C8: New York, N.Y.10019
A10: PREMISES: | C10: Common Area
A13: KW: | C13: 4150.8
A16: KWHR: | C16: 1126604
A19: UTILITY RATE: | C19: Consolidated Edison SC-4 II Rate in effect August | H19: =+RatesFuelTax!D2 -> 2001
A22: ENERGY:
C23: On-Peak | D23: Kwhr: | E23: 845594 | F23: @ | G23: 0.11269999999999999 | H23: =E23*G23 -> 95298.443799999994
C24: Off-Peak | D24: Kwhr: | E24: 281010 | F24: @ | G24: 4.8500000000000001E-2 | H24: =E24*G24 -> 13628.985000000001
A26: DEMAND:
C27: KW: | E27: 4150.8 | F27: @ | G27: 31.29 | H27: =E27*G27 -> 129878.53200000001
A29: FUEL ADJUSTMENT: | D29: Kwhr: | E29: 1126604 | F29: @ | G29: =+RatesFuelTax!E15 -> 2.1342E-2 | H29: =E29*G29 -> 24043.982567999999
D31: Sub-Total | H31: =SUM(H23:H30) -> 262849.94336799998
A33: GROSS RECEIPT TAX: | E33: =+RatesFuelTax!F15 -> 6.8462999999999996E-2 | H33: =H31*E33 -> 17995.495672803383
D35: Sub-Total | H35: =SUM(H31:H34) -> 280845.43904080335
A37: SALES TAX: | E37: 8.2500000000000004E-2 | H37: =H35*E37 -> 23169.748720866279
D38: TOTAL COST FOR
A39: CHARGE PER MONTH: | H39: =SUM(H34:H38) -> 304015.18776166963