A4: CLIENT: | C4: Demo Company
A7: ADDRESS: | C7: Demo Building
C8: New York, N.Y.10019
A10: PREMISES: | C10: Common Area
A13: KW: | C13: 3606.8
A16: KWHR: | C16: 896886
A19: UTILITY RATE: | C19: Consolidated Edison SC-4 II Rate in effect December 1998 | H19: =+RatesFuelTax!D2 -> 2001
A22: ENERGY:
C23: On-Peak | D23: Kwhr: | E23: 688488 | F23: @ | G23: =+RatesFuelTax!B19 -> 9.3899999999999997E-2 | H23: =E23*G23 -> 64649.023199999996
C24: Off-Peak | D24: Kwhr: | E24: 208438 | F24: @ | G24: =+RatesFuelTax!C19 -> 5.4100000000000002E-2 | H24: =E24*G24 -> 11276.495800000001
A26: DEMAND:
C27: KW: | E27: 3606.8 | F27: @ | G27: =+RatesFuelTax!D19 -> 20.91 | H27: =E27*G27 -> 75418.188000000009
A29: FUEL ADJUSTMENT: | D29: Kwhr: | E29: 896886 | F29: @ | G29: =+RatesFuelTax!E19 -> 7.5799999999999999E-4 | H29: =E29*G29 -> 679.83958800000005
D31: Sub-Total | H31: =SUM(H23:H30) -> 152023.546588
A33: GROSS RECEIPT TAX: | E33: =+RatesFuelTax!F19 -> 6.8462999999999996E-2 | H33: =H31*E33 -> 10407.988070054244
D35: Sub-Total | H35: =SUM(H31:H34) -> 162431.53465805424
A37: SALES TAX: | E37: 8.2500000000000004E-2 | H37: =H35*E37 -> 13400.601609289475
D38: TOTAL COST FOR
A39: CHARGE PER MONTH: | H39: =SUM(H34:H38) -> 175832.13626734371