A1: HOME
A4: CLIENT: | C4: Mendik Realty Company
A7: ADDRESS: | C7: Two Penn Plaza
C8: New York, N.Y.10121
A10: PREMISES: | C10: Common Area(New)
A13: KW: | C13: 3710.6
A16: KWHR: | C16: 781102
A19: UTILITY RATE: | C19: Consolidated Edison SC-4 II Rate in effect February | H19: =+RatesFuelTax!D2 -> 2000
A22: ENERGY:
C23: On-Peak | D23: Kwhr: | E23: 562759 | F23: @ | G23: =+RatesFuelTax!B9 -> 4.58E-2 | H23: =E23*G23 -> 25774.3622
C24: Off-Peak | D24: Kwhr: | E24: 218343 | F24: @ | G24: =+RatesFuelTax!C9 -> 3.6299999999999999E-2 | H24: =E24*G24 -> 7925.8508999999995
A26: DEMAND:
C27: KW: | E27: 3710.6 | F27: @ | G27: =+RatesFuelTax!D9 -> 15.67 | H27: =E27*G27 -> 58145.101999999999
A29: FUEL ADJUSTMENT: | D29: Kwhr: | E29: 781102 | F29: @ | G29: =+RatesFuelTax!E9 -> 2.6558999999999999E-2 | H29: =E29*G29 -> 20745.288017999999
D31: Sub-Total | H31: =SUM(H23:H30) -> 112590.603118
A33: GROSS RECEIPT TAX: | E33: =+RatesFuelTax!F9 -> 6.8686999999999998E-2 | H33: =H31*E33 -> 7733.5107563660658
D35: Sub-Total | H35: =SUM(H31:H34) -> 120324.11387436607
A37: SALES TAX: | E37: 8.2500000000000004E-2 | H37: =H35*E37 -> 9926.7393946352004
A39: CHARGE PER MONTH: | H39: =SUM(H34:H38) -> 130250.85326900127