A1: HOME
A4: CLIENT: | C4: Mendik Realty Company
A7: ADDRESS: | C7: Two Penn Plaza
C8: New York, N.Y.10121
A10: PREMISES: | C10: Common Area(New)
A13: KW: | C13: 3710.6
A16: KWHR: | C16: 781102
A19: UTILITY RATE: | C19: Consolidated Edison SC-4 II Rate in effect October | H19: =+RatesFuelTax!D2 -> 2000
A22: ENERGY:
C23: On-Peak | D23: Kwhr: | E23: 562759 | F23: @ | G23: 6.0199999999999997E-2 | H23: =E23*G23 -> 33878.091799999995
C24: Off-Peak | D24: Kwhr: | E24: 218343 | F24: @ | G24: 4.3900000000000002E-2 | H24: =E24*G24 -> 9585.2577000000001
A26: DEMAND:
C27: KW: | E27: 3710.6 | F27: @ | G27: 18.96000 | H27: =E27*G27 -> 70352.975999999995
A29: FUEL ADJUSTMENT: | D29: Kwhr: | E29: 781102 | F29: @ | G29: =+RatesFuelTax!E17 -> 1.1573E-2 | H29: =E29*G29 -> 9039.6934459999993
D31: Sub-Total | H31: =SUM(H23:H30) -> 122856.018946
A33: GROSS RECEIPT TAX: | E33: =+RatesFuelTax!F17 -> 6.8462999999999996E-2 | H33: =H31*E33 -> 8411.0916250999981
D35: Sub-Total | H35: =SUM(H31:H34) -> 131267.1105711
A37: SALES TAX: | E37: 8.2500000000000004E-2 | H37: =H35*E37 -> 10829.536622115751
A39: CHARGE PER MONTH: | H39: =SUM(H34:H38) -> 142096.64719321576