A1: HOME
A4: CLIENT: | C4: Mendik Realty Company
A7: ADDRESS: | C7: Two Penn Plaza
C8: New York, N.Y.10121
A10: PREMISES: | C10: Common Area(New)
A13: KW: | C13: 3710.6
A16: KWHR: | C16: 781102
A19: UTILITY RATE: | C19: Consolidated Edison SC-4 II Rate in effect November | H19: =+RatesFuelTax!D2 -> 2000
A22: ENERGY:
C23: On-Peak | D23: Kwhr: | E23: 562759 | F23: @ | G23: =+RatesFuelTax!B18 -> 9.3899999999999997E-2 | H23: =E23*G23 -> 52843.070099999997
C24: Off-Peak | D24: Kwhr: | E24: 218343 | F24: @ | G24: =+RatesFuelTax!C18 -> 5.4100000000000002E-2 | H24: =E24*G24 -> 11812.356300000001
A26: DEMAND:
C27: KW: | E27: 3710.6 | F27: @ | G27: =+RatesFuelTax!D18 -> 20.91 | H27: =E27*G27 -> 77588.645999999993
A29: FUEL ADJUSTMENT: | D29: Kwhr: | E29: 781102 | F29: @ | G29: =+RatesFuelTax!E18 -> -2.5490000000000001E-3 | H29: =E29*G29 -> -1991.028998
D31: Sub-Total | H31: =SUM(H23:H30) -> 140253.04340200001
A33: GROSS RECEIPT TAX: | E33: =+RatesFuelTax!F18 -> 6.8462999999999996E-2 | H33: =H31*E33 -> 9602.144110431127
D35: Sub-Total | H35: =SUM(H31:H34) -> 149855.18751243115
A37: SALES TAX: | E37: 8.2500000000000004E-2 | H37: =H35*E37 -> 12363.05296977557
A39: CHARGE PER MONTH: | H39: =SUM(H34:H38) -> 162218.24048220672