A1: HOME
B6: CLIENT: | D6: Mendik Realty Company
B8: ADDRESS: | D8: Two Penn Plaza
D9: New York,N.Y.10121
B11: PREMISES: | D11: =+RatesFuelTax!D2 -> 2000 | E11: Monthly Summary of Common Area Cost(New)
B14: JANUARY | H14: =+JAN!H39 -> 118399.86751042912
B16: FEBRUARY | H16: =+FEB!H39 -> 130250.85326900127
B18: MARCH | H18: =+MAR!H39 -> 125137.26360771572
B20: APRIL | H20: =+APR!H39 -> 122051.11258254929
B22: MAY | H22: =+MAY!H39 -> 132156.19238377089
B24: JUNE | H24: =+JUN!H39 -> 256876.11681928919
B26: JULY | H26: =+JUL!H39 -> 273609.48102335248
B28: AUGUST | H28: =+AUG!H39 -> 295716.40890759183
B30: SEPTEMBER | H30: =+SEP!H39 -> 279552.26586964965
B32: OCTOBER | H32: =+OCT!H39 -> 142096.64719321576
B34: NOVEMBER | H34: =+NOV!H39 -> 162218.24048220672
B36: DECEMBER | H36: =+DEC!H39 -> 165205.88785608968
D38: TOTAL COST FOR | G38: =+RatesFuelTax!D2 -> 2000 | H38: =SUM(H14:H37) -> 2203270.3375048614