A1: HOME
A4: CLIENT: | C4: Mendik Realty Company
A7: ADDRESS: | C7: Two Penn Plaza
C8: New York, N.Y.10121
A10: PREMISES: | C10: Common Area(New)
A13: KW: | C13: 3722
A16: KWHR: | C16: 1252279
A19: UTILITY RATE: | C19: Consolidated Edison SC-4 II Rate in effect September | H19: =+RatesFuelTax!D2 -> 2000
A22: ENERGY:
C23: On-Peak | D23: Kwhr: | E23: 806103 | F23: @ | G23: 0.11269999999999999 | H23: =E23*G23 -> 90847.808099999995
C24: Off-Peak | D24: Kwhr: | E24: 446176 | F24: @ | G24: 4.8500000000000001E-2 | H24: =E24*G24 -> 21639.536
A26: DEMAND:
C27: KW: | E27: 3722 | F27: @ | G27: 31.29 | H27: =E27*G27 -> 116461.38
A29: FUEL ADJUSTMENT: | D29: Kwhr: | E29: 1252279 | F29: @ | G29: =+RatesFuelTax!E16 -> 1.0182E-2 | H29: =E29*G29 -> 12750.704777999999
D31: Sub-Total | H31: =SUM(H23:H30) -> 241699.42887800001
A33: GROSS RECEIPT TAX: | E33: =+RatesFuelTax!F16 -> 6.8462999999999996E-2 | H33: =H31*E33 -> 16547.467999274515
D35: Sub-Total | H35: =SUM(H31:H34) -> 258246.89687727453
A37: SALES TAX: | E37: 8.2500000000000004E-2 | H37: =H35*E37 -> 21305.368992375148
A39: CHARGE PER MONTH: | H39: =SUM(H34:H38) -> 279552.26586964965