A4: CLIENT: | C4: Demo Company
A5: OVERTIME COOLINGAll Floors
A7: ADDRESS: | C7: Demo Building
C8: New York, N.Y.10019
A10: PREMISES: | C10: Common Area
A13: KW: | C13: 3606.8
A16: KWHR: | C16: 896886
A19: UTILITY RATE: | C19: Consolidated Edison SC-4 II Rate in effect April | H19: =+RatesFuelTax!D2 -> 2001
A22: ENERGY:
C23: On-Peak | D23: Kwhr: | E23: 688488 | F23: @ | G23: =+RatesFuelTax!B11 -> 4.58E-2 | H23: =E23*G23 -> 31532.750400000001
C24: Off-Peak | D24: Kwhr: | E24: 208438 | F24: @ | G24: =+RatesFuelTax!C11 -> 3.6299999999999999E-2 | H24: =E24*G24 -> 7566.2993999999999
A26: DEMAND:
C27: KW: | E27: 3606.8 | F27: @ | G27: =+RatesFuelTax!D11 -> 15.67 | H27: =E27*G27 -> 56518.556000000004
A29: FUEL ADJUSTMENT: | D29: Kwhr: | E29: 896886 | F29: @ | G29: =+RatesFuelTax!E11 -> 1.7513000000000001E-2 | H29: =E29*G29 -> 15707.164518000001
D31: Sub-Total | H31: =SUM(H23:H30) -> 111324.77031800001
A33: GROSS RECEIPT TAX: | E33: =+RatesFuelTax!F11 -> 6.8462999999999996E-2 | H33: =H31*E33 -> 7621.6277502812345
D35: Sub-Total | H35: =SUM(H31:H34) -> 118946.39806828124
A37: SALES TAX: | E37: 8.2500000000000004E-2 | H37: =H35*E37 -> 9813.0778406332029
D38: TOTAL COST FOR
A39: CHARGE PER MONTH: | H39: =SUM(H34:H38) -> 128759.47590891444