B9: 110 WILLIAM STREET
B11: HOURLY OVERTIME COOLING
B13: ZONE 8
B15: ELECTRIC:
C17: KWHR: | D17: 874 | F17: @ | G17: 0.12975300000000001 | H17: =D17*G17 -> 113.404122
B19: STEAM:
C21: MLBS: | D21: =18*1100*0.5*0.75/1000 -> 7.4249999999999998 | F21: @ | G21: 14.12 | H21: =D21*G21 -> 104.84099999999999
B23: WATER:
C25: 3300 GPM x 60 Min.x 2% Evap=
C26: 3960 Gallons/748= | E26: =3300*60*0.02/748 -> 5.2941176470588234 | F26: CCF @ | G26: 3.73 | H26: =E26*G26 -> 19.747058823529411
B28: REPAIRS & MAINTENANCE:
C30: 57000 | D30: Per Annum | G30: = | H30: =C30/C31 -> 17.168674698795179
C31: 3320 | D31: Hours Per Annum
B33: LABOR:
C35: One Engineer | H35: 57.58
B37: TOTAL COOLING PER HOUR: | H37: =SUM(H17,H21,H26,H30,H35) -> 312.74085552232458