A4: CLIENT: | C4: Mendik Realty Company
A7: ADDRESS: | C7: 20 Broad Street
C8: New York, N.Y.10005
A10: PREMISES: | C10: Common Area
A13: KW: | C13: 1440.79
A16: KWHR: | C16: 400066
A19: UTILITY RATE: | C19: Consolidated Edison SC-4 II Rate in effect September | H19: =+RatesFuelTax!D2 -> 2000
A22: ENERGY:
C23: On-Peak | D23: Kwhr: | E23: 302595 | F23: @ | G23: 0.11269999999999999 | H23: =E23*G23 -> 34102.4565
C24: Off-Peak | D24: Kwhr: | E24: 97471 | F24: @ | G24: 4.5400000000000003E-2 | H24: =E24*G24 -> 4425.1833999999999
A26: DEMAND:
C27: KW: | E27: 1440.79 | F27: @ | G27: 31.29 | H27: =E27*G27 -> 45082.319100000001
A29: FUEL ADJUSTMENT: | D29: Kwhr: | E29: 400066 | F29: @ | G29: =+RatesFuelTax!E16 -> 1.0182E-2 | H29: =E29*G29 -> 4073.4720120000002
D31: Sub-Total | H31: =SUM(H23:H30) -> 87683.431012000001
A33: GROSS RECEIPT TAX: | E33: =+RatesFuelTax!F16 -> 6.8462999999999996E-2 | H33: =H31*E33 -> 6003.0707373745554
D35: Sub-Total | H35: =SUM(H31:H34) -> 93686.501749374554
A37: SALES TAX: | E37: 8.2500000000000004E-2 | H37: =H35*E37 -> 7729.136394323401
A39: CHARGE PER MONTH: | H39: =SUM(H34:H38) -> 101415.63814369796