B6: CLIENT: | D6: Mendik Realty Company
B8: ADDRESS: | D8: 20 Broad Street
D9: New York,N.Y.10005
B11: PREMISES: | D11: =+RatesFuelTax!D2 -> 2000 | E11: Monthly Summary of Common Area Cost(New)
B14: JANUARY | H14: =+JAN!H39 -> 39833.669905142589
B16: FEBRUARY | H16: =+FEB!H39 -> 44302.971517300641
B18: MARCH | H18: =+MAR!H39 -> 42374.509616942094
B20: APRIL | H20: =+APR!H39 -> 41211.655113290537
B22: MAY | H22: =+MAY!H39 -> 44087.472118070327
B24: JUNE | H24: =+JUN!H39 -> 94520.762813847745
B26: JULY | H26: =+JUL!H39 -> 99866.576393459633
B28: AUGUST | H28: =+AUG!H39 -> 106929.08419797933
B30: SEPTEMBER | H30: =+SEP!H39 -> 101415.63814369796
B32: OCTOBER | H32: =+OCT!H39 -> 47836.264970454024
B34: NOVEMBER | H34: =+NOV!H39 -> 55179.396533694111
B36: DECEMBER | H36: =+DEC!H39 -> 56306.11269863393
D38: TOTAL COST FOR | G38: =+RatesFuelTax!D2 -> 2000 | H38: =SUM(H14:H37) -> 773864.11402251292