A4: CLIENT: | C4: Mendik Realty Company
A7: ADDRESS: | C7: 20 Broad Street
C8: New York, N.Y.10005
A10: PREMISES: | C10: Common Area
A13: KW: | C13: 1125.27
A16: KWHR: | C16: 294573
A19: UTILITY RATE: | C19: Consolidated Edison SC-4 II Rate in effect November | H19: =+RatesFuelTax!D2 -> 2000
A22: ENERGY:
C23: On-Peak | D23: Kwhr: | E23: 225952 | F23: @ | G23: =+RatesFuelTax!B18 -> 9.3899999999999997E-2 | H23: =E23*G23 -> 21216.892799999998
C24: Off-Peak | D24: Kwhr: | E24: 68621 | F24: @ | G24: =+RatesFuelTax!C18 -> 5.4100000000000002E-2 | H24: =E24*G24 -> 3712.3960999999999
A26: DEMAND:
C27: KW: | E27: 1125.27 | F27: @ | G27: =+RatesFuelTax!D18 -> 20.91 | H27: =E27*G27 -> 23529.395700000001
A29: FUEL ADJUSTMENT: | D29: Kwhr: | E29: 294573 | F29: @ | G29: =+RatesFuelTax!E18 -> -2.5490000000000001E-3 | H29: =E29*G29 -> -750.86657700000001
D31: Sub-Total | H31: =SUM(H23:H30) -> 47707.818023
A33: GROSS RECEIPT TAX: | E33: =+RatesFuelTax!F18 -> 6.8462999999999996E-2 | H33: =H31*E33 -> 3266.2203453086486
D35: Sub-Total | H35: =SUM(H31:H34) -> 50974.038368308647
A37: SALES TAX: | E37: 8.2500000000000004E-2 | H37: =H35*E37 -> 4205.3581653854635
A39: CHARGE PER MONTH: | H39: =SUM(H34:H38) -> 55179.396533694111