A4: CLIENT: | C4: Mendik Realty Company
A7: ADDRESS: | C7: 20 Broad Street
C8: New York, N.Y.10005
A10: PREMISES: | C10: Common Area
A13: KW: | C13: 1125.27
A16: KWHR: | C16: 294573
A19: UTILITY RATE: | C19: Consolidated Edison SC-4 II Rate in effect October | H19: =+RatesFuelTax!D2 -> 2000
A22: ENERGY:
C23: On-Peak | D23: Kwhr: | E23: 225952 | F23: @ | G23: 6.0199999999999997E-2 | H23: =E23*G23 -> 13602.310399999998
C24: Off-Peak | D24: Kwhr: | E24: 68621 | F24: @ | G24: 4.3900000000000002E-2 | H24: =E24*G24 -> 3012.4619000000002
A26: DEMAND:
C27: KW: | E27: 1125.27 | F27: @ | G27: 18.96 | H27: =E27*G27 -> 21335.119200000001
A29: FUEL ADJUSTMENT: | D29: Kwhr: | E29: 294573 | F29: @ | G29: =+RatesFuelTax!E17 -> 1.1573E-2 | H29: =E29*G29 -> 3409.0933289999998
D31: Sub-Total | H31: =SUM(H23:H30) -> 41358.984829000001
A33: GROSS RECEIPT TAX: | E33: =+RatesFuelTax!F17 -> 6.8462999999999996E-2 | H33: =H31*E33 -> 2831.5601783478269
D35: Sub-Total | H35: =SUM(H31:H34) -> 44190.545007347828
A37: SALES TAX: | E37: 8.2500000000000004E-2 | H37: =H35*E37 -> 3645.7199631061958
A39: CHARGE PER MONTH: | H39: =SUM(H34:H38) -> 47836.264970454024