A4: CLIENT: | C4: Mendik Realty Company
A7: ADDRESS: | C7: 20 Broad Street
C8: New York, N.Y.10005
A10: PREMISES: | C10: Common Area
A13: KW: | C13: 1125.27
A16: KWHR: | C16: 294573
A19: UTILITY RATE: | C19: Consolidated Edison SC-4 II Rate in effect December | H19: =+RatesFuelTax!D2 -> 2000
A22: ENERGY:
C23: On-Peak | D23: Kwhr: | E23: 225952 | F23: @ | G23: =+RatesFuelTax!B19 -> 9.3899999999999997E-2 | H23: =E23*G23 -> 21216.892799999998
C24: Off-Peak | D24: Kwhr: | E24: 68621 | F24: @ | G24: =+RatesFuelTax!C19 -> 5.4100000000000002E-2 | H24: =E24*G24 -> 3712.3960999999999
A26: DEMAND:
C27: KW: | E27: 1125.27 | F27: @ | G27: =+RatesFuelTax!D19 -> 20.91 | H27: =E27*G27 -> 23529.395700000001
A29: FUEL ADJUSTMENT: | D29: Kwhr: | E29: 294573 | F29: @ | G29: =+RatesFuelTax!E19 -> 7.5799999999999999E-4 | H29: =E29*G29 -> 223.28633400000001
D31: Sub-Total | H31: =SUM(H23:H30) -> 48681.970933999997
A33: GROSS RECEIPT TAX: | E33: =+RatesFuelTax!F19 -> 6.8462999999999996E-2 | H33: =H31*E33 -> 3332.9137760544418
D35: Sub-Total | H35: =SUM(H31:H34) -> 52014.884710054437
A37: SALES TAX: | E37: 8.2500000000000004E-2 | H37: =H35*E37 -> 4291.2279885794915
A39: CHARGE PER MONTH: | H39: =SUM(H34:H38) -> 56306.11269863393