A2: Home | B2: Cumulative Profile
C4: Sub-Metered Revenue | E4: Rent Inclusion Revenue | G4: MAC Adjustment Revenue | I4: Electric Expense | K4: Recovery Factor
A5: Month | C5: 1999 | D5: 2000 | E5: 1999 | F5: 2000 | G5: 1999 | H5: 2000 | I5: 1999 | J5: 2000 | K5: 1999 | L5: 2000
A6: JAN | C6: 66758.45 | D6: 87104.79 | E6: 443687.2 | F6: 442468.31 | G6: 0 | H6: 88605.41 | I6: =276271.54+9685.74 -> 285957.28 | J6: 346576.68 | K6: =SUM(C6+E6+G6)/I6 -> 1.7850416327921432 | L6: =(D6+F6+H6)/J6 -> 1.783670240017303
A7: FEB | C7: 71214.33 | D7: 95902.12 | E7: 445293.3 | F7: 442468.31 | G7: 0 | H7: 88605.41 | I7: =319114.53+10401.05 -> 329515.58 | J7: 440289.44 | K7: =SUM(C7+E7+G7)/I7 -> 1.5674755955393671 | L7: =(D7+F7+H7)/J7 -> 1.4240083523238711
A8: MAR | C8: 65418.239999999998 | D8: 90025.31 | E8: 446097.94 | F8: 442468.31 | G8: 0 | H8: 88605.41 | I8: =281337.98+9130.99 -> 290468.97 | J8: 392481.28000000003 | K8: =SUM(C8+E8+G8)/I8 -> 1.7610011148523026 | L8: =(D8+F8+H8)/J8 -> 1.5824933866909525
A9: APR | C9: 68472.3 | D9: 89732.35 | E9: 447261 | F9: 431010.97 | G9: 0 | H9: 0 | I9: =276914.67+9157.73 -> 286072.4 | J9: 363230.32 | K9: =SUM(C9+E9+G9)/I9 -> 1.8028069118167291 | L9: =(D9+F9+H9)/J9 -> 1.4336449666426523
A10: MAY | C10: 62377.52 | D10: 92684.6 | E10: 446176.36 | F10: 525919.69 | G10: 0 | H10: 0 | I10: =268624.45+10673.28 -> 279297.73 | J10: 400154.26 | K10: =SUM(C10+E10+G10)/I10 -> 1.8208306956164662 | L10: =(D10+F10+H10)/J10 -> 1.54591454305647
A11: JUN | C11: 117708.01 | D11: 130020.32 | E11: 443245.82 | F11: 525919.69 | G11: 0 | H11: 0 | I11: =476549.47+13926.79 -> 490476.26 | J11: 557413.99 | K11: =SUM(C11+E11+G11)/I11 -> 1.1436921126417006 | L11: =(D11+F11+H11)/J11 -> 1.1767555564940162
A12: JUL | C12: 129714.72 | D12: 208691.77 | E12: 440976.23 | F12: 592245.19 | G12: 27116 | H12: 51899.79 | I12: =590905.26+14642.56 -> 605547.82 | J12: 902553.8 | K12: =SUM(C12+E12+G12)/I12 -> 0.98721674862936493 | L12: =(D12+F12+H12)/J12 -> 0.94491513968474783
A13: AUG | C13: 130836.1 | D13: 152334.53 | E13: 433865.59 | F13: 592245.19 | G13: 27116 | H13: 51899.79 | I13: =589089.03+14461.03 -> 603550.06 | J13: 712983.57 | K13: =SUM(C13+E13+G13)/I13 -> 0.98056106563886347 | L13: =(D13+F13+H13)/J13 -> 1.1171078037604711
A14: SEP | C14: 137269.98 | D14: 166999.94 | E14: 434555.15 | F14: 592245.19 | G14: 27116 | H14: 51899.79 | I14: =640868.12+15090.81 -> 655958.93 | J14: 741913.64 | K14: =SUM(C14+E14+G14)/I14 -> 0.91307717999966853 | L14: =(D14+F14+H14)/J14 -> 1.0933144725577493
B16: Revenue: | C16: =SUM(C6:C14) -> 849769.65 | D16: =SUM(D6:D14) -> 1113495.73 | E16: =SUM(E6:E14) -> 3981158.59 | F16: =SUM(F6:F14) -> 4586990.85 | G16: =SUM(G6:G14) -> 81348 | H16: =SUM(H6:H14) -> 421515.6 | I16: - | J16: - | K16: =(C16+E16+G16) -> 4912276.24 | L16: =(D16+F16+H16) -> 6122002.1799999997
B17: Expense: | C17: - | D17: - | E17: - | F17: - | G17: - | H17: - | I17: =SUM(I6:I14) -> 3826845.03 | J17: =SUM(J6:J14) -> 4857596.98 | K17: =SUM(I17) -> 3826845.03 | L17: =SUM(J17) -> 4857596.98
B18: Net: | C18: - | D18: - | E18: - | F18: - | G18: - | H18: - | I18: - | J18: - | K18: =+K16-K17 -> 1085431.21 | L18: =+L16-L17 -> 1264405.2
U22: Sub-Metered | V22: Rent Inclusion | W22: MAC Adjustment | X22: Electric
S23: Month | U23: Revenue | V23: Revenue | W23: Revenue | X23: Expense
S24: JAN 99 | U24: =+C6 -> 66758.45 | V24: =+E6 -> 443687.2 | W24: =+G6 -> 0 | X24: =+I6 -> 285957.28
S25: JAN 00 | U25: =+D6 -> 87104.79 | V25: =+F6 -> 442468.31 | W25: =+H6 -> 88605.41 | X25: =+J6 -> 346576.68
S26: FEB 99 | U26: =+C7 -> 71214.33 | V26: =+E7 -> 445293.3 | W26: =+G7 -> 0 | X26: =+I7 -> 329515.58
S27: FEB 00 | U27: =+D7 -> 95902.12 | V27: =+F7 -> 442468.31 | W27: =+H7 -> 88605.41 | X27: =+J7 -> 440289.44
S28: MAR 99 | U28: =+C8 -> 65418.239999999998 | V28: =+E8 -> 446097.94 | W28: =+G8 -> 0 | X28: =+I8 -> 290468.97
S29: MAR 00 | U29: =+D8 -> 90025.31 | V29: =+F8 -> 442468.31 | W29: =+H8 -> 88605.41 | X29: =+J8 -> 392481.28000000003
S30: APR 99 | U30: =+C9 -> 68472.3 | V30: =+E9 -> 447261 | W30: =+G9 -> 0 | X30: =+I9 -> 286072.4
S31: APR 00 | U31: =+D9 -> 89732.35 | V31: =+F9 -> 431010.97 | W31: =+H9 -> 0 | X31: =+J9 -> 363230.32
S32: MAY 99 | U32: =+C10 -> 62377.52 | V32: =+E10 -> 446176.36 | W32: =+G10 -> 0 | X32: =+I10 -> 279297.73
S33: MAY 00 | U33: =+D10 -> 92684.6 | V33: =+F10 -> 525919.69 | W33: =+H10 -> 0 | X33: =+J10 -> 400154.26
S34: JUN 99 | U34: =+D11 -> 130020.32 | V34: =+E11 -> 443245.82 | W34: =+G11 -> 0 | X34: =+I11 -> 490476.26
S35: JUN 00 | U35: =+D11 -> 130020.32 | V35: =+F11 -> 525919.69 | W35: =+H11 -> 0 | X35: =+J11 -> 557413.99
S36: JUL 99 | U36: =+C12 -> 129714.72 | V36: =+E12 -> 440976.23 | W36: =+G12 -> 27116 | X36: =+I12 -> 605547.82
S37: JUL 00 | U37: =+D12 -> 208691.77 | V37: =+F12 -> 592245.19 | W37: =+H12 -> 51899.79 | X37: =+J12 -> 902553.8
S38: AUG 99 | U38: =+C13 -> 130836.1 | V38: =+E13 -> 433865.59 | W38: =+G13 -> 27116 | X38: =+I13 -> 603550.06
S39: AUG 00 | U39: =+D13 -> 152334.53 | V39: =+F13 -> 592245.19 | W39: =+H13 -> 51899.79 | X39: =+J13 -> 712983.57
S40: SEP 99 | U40: =+C14 -> 137269.98 | V40: =+E14 -> 434555.15 | W40: =+G14 -> 27116 | X40: =+I14 -> 655958.93
S41: SEP 00 | U41: =+D14 -> 166999.94 | V41: =+F14 -> 592245.19 | W41: =+H14 -> 51899.79 | X41: =+J14 -> 741913.64
S42: OCT 00
S43: OCT 99
S44: NOV 00
S45: NOV 99
S46: DEC 00
S47: DEC 99
S52: OCT | V52: 96650.45 | X52: 434318.58 | AB52: =493377.85+12499.46 -> 505877.31
S53: NOV | V53: 88477.63 | X53: 436420.54 | AB53: =325001.89+11251.66 -> 336253.55
S54: DEC | V54: 88540.12 | X54: 443273.22 | AB54: 372626.78