B3: Home | C3: Montly Profile
G4: ONE PENN PLAZA
F5: Comparative Electrical Revenue & Expense Profile
C8: Sub-Metered Revenue | E8: Rent Inclusion Revenue | G8: MAC Adjustment Revenue | I8: Electric Expense | K8: Total
C9: 1999 | D9: 2000 | E9: 1999 | F9: 2000 | G9: 1999 | H9: 2000 | I9: 1999 | J9: 2000 | K9: 1999 | L9: 2000
B11: Revenue: | C11: =+'Monthly Profile'!C16 -> 849769.65 | D11: =+'Monthly Profile'!D16 -> 1113495.73 | E11: =+'Monthly Profile'!E16 -> 3981158.59 | F11: =+'Monthly Profile'!F16 -> 4586990.85 | G11: =+'Monthly Profile'!G16 -> 81348 | H11: =+'Monthly Profile'!H16 -> 421515.6 | I11: - | J11: - | K11: =+'Monthly Profile'!K16 -> 4912276.24 | L11: =+'Monthly Profile'!L16 -> 6122002.1799999997
B12: Expense: | C12: - | D12: - | E12: - | F12: - | G12: - | H12: - | I12: =+'Monthly Profile'!I17 -> 3826845.03 | J12: =+'Monthly Profile'!J17 -> 4857596.98 | K12: =+'Monthly Profile'!K17 -> 3826845.03 | L12: =+'Monthly Profile'!L17 -> 4857596.98
B13: Net: | C13: - | D13: - | E13: - | F13: - | G13: - | H13: - | I13: - | J13: - | K13: =+'Monthly Profile'!K18 -> 1085431.21 | L13: =+'Monthly Profile'!L18 -> 1264405.2
U17: Sub-Metered | V17: Rent Inclusion | W17: MAC Adjustment | X17: Electric
S18: Year | U18: Revenue | V18: Revenue | W18: Revenue | X18: Expense
S19: 2000 | U19: =+D11 -> 1113495.73 | V19: =+F11 -> 4586990.85 | W19: =+H11 -> 421515.6 | X19: =+J12 -> 4857596.98
S20: 1999 | U20: =+C11 -> 849769.65 | V20: =+E11 -> 3981158.59 | W20: =+G11 -> 81348 | X20: =+I12 -> 3826845.03