A4: CLIENT: | C4: Mendik Realty Company
A7: ADDRESS: | C7: Two Park Avenue
C8: New York, N.Y.10016
A10: PREMISES: | C10: Common Area
A13: KW: | C13: 536.29
A16: KWHR: | C16: 131282
A19: UTILITY RATE: | C19: Consolidated Edison SC-4 II Rate in effect October | H19: =+RatesFuelTax!D2 -> 2000
A22: ENERGY:
C23: On-Peak | D23: Kwhr: | E23: 90019 | F23: @ | G23: 6.0199999999999997E-2 | H23: =E23*G23 -> 5419.1437999999998
C24: Off-Peak | D24: Kwhr: | E24: 41263 | F24: @ | G24: 4.3900000000000002E-2 | H24: =E24*G24 -> 1811.4457
A26: DEMAND:
C27: KW: | E27: 536.29 | F27: @ | G27: 18.96 | H27: =E27*G27 -> 10168.0584
A29: FUEL ADJUSTMENT: | D29: Kwhr: | E29: 131282 | F29: @ | G29: =+RatesFuelTax!E17 -> 1.1573E-2 | H29: =E29*G29 -> 1519.3265859999999
D31: Sub-Total | H31: =SUM(H23:H30) -> 18917.974485999999
A33: GROSS RECEIPT TAX: | E33: =+RatesFuelTax!F17 -> 6.8462999999999996E-2 | H33: =H31*E33 -> 1295.1812872350179
D35: Sub-Total | H35: =SUM(H31:H34) -> 20213.155773235016
A37: SALES TAX: | E37: 8.2500000000000004E-2 | H37: =H35*E37 -> 1667.5853512918889
A39: CHARGE PER MONTH: | H39: =SUM(H34:H38) -> 21880.741124526903