B6: CLIENT: | D6: Mendik Realty Company
B8: ADDRESS: | D8: Two Park Avenue
D9: New York,N.Y.10016
B11: PREMISES: | D11: =+RatesFuelTax!D2 -> 2000 | E11: Monthly Summary of Common Area Cost
B14: JANUARY | H14: =+JAN!H39 -> 18265.952120250171
B16: FEBRUARY | H16: =+FEB!H39 -> 20257.780476030686
B18: MARCH | H18: =+MAR!H39 -> 19398.325145084298
B20: APRIL | H20: =+APR!H39 -> 18879.969560785128
B22: MAY | H22: =+MAY!H39 -> 20210.021054301076
B24: JUNE | H24: =+JUN!H39 -> 32626.004682270708
B26: JULY | H26: =+JUL!H39 -> 34380.237979673155
B28: AUGUST | H28: =+AUG!H39 -> 36697.805954939628
B30: SEPTEMBER | H30: =+SEP!H39 -> 35003.246654410643
B32: OCTOBER | H32: =+OCT!H39 -> 21880.741124526903
B34: NOVEMBER | H34: =+NOV!H39 -> 24941.509090513449
B36: DECEMBER | H36: =+DEC!H39 -> 25443.651349191703
D38: TOTAL COST FOR | G38: =+RatesFuelTax!D2 -> 2000 | H38: =SUM(H14:H37) -> 307985.24519197759