A4: CLIENT: | C4: Mendik Realty Company
A7: ADDRESS: | C7: Two Park Avenue
C8: New York, N.Y.10016
A10: PREMISES: | C10: Common Area
A13: KW: | C13: 536.29
A16: KWHR: | C16: 131282
A19: UTILITY RATE: | C19: Consolidated Edison SC-4 II Rate in effect September | H19: =+RatesFuelTax!D2 -> 2000
A22: ENERGY:
C23: On-Peak | D23: Kwhr: | E23: 90019 | F23: @ | G23: 0.11269999999999999 | H23: =E23*G23 -> 10145.141299999999
C24: Off-Peak | D24: Kwhr: | E24: 41263 | F24: @ | G24: 4.8500000000000001E-2 | H24: =E24*G24 -> 2001.2555
A26: DEMAND:
C27: KW: | E27: 536.29 | F27: @ | G27: 31.29 | H27: =E27*G27 -> 16780.514099999997
A29: FUEL ADJUSTMENT: | D29: Kwhr: | E29: 131282 | F29: @ | G29: =+RatesFuelTax!E16 -> 1.0182E-2 | H29: =E29*G29 -> 1336.7133240000001
D31: Sub-Total | H31: =SUM(H23:H30) -> 30263.624223999996
A33: GROSS RECEIPT TAX: | E33: =+RatesFuelTax!F16 -> 6.8462999999999996E-2 | H33: =H31*E33 -> 2071.9385052477114
D35: Sub-Total | H35: =SUM(H31:H34) -> 32335.562729247707
A37: SALES TAX: | E37: 8.2500000000000004E-2 | H37: =H35*E37 -> 2667.6839251629358
A39: CHARGE PER MONTH: | H39: =SUM(H34:H38) -> 35003.246654410643