A4: CLIENT: | C4: Mendik Realty Company
A7: ADDRESS: | C7: Two Park Avenue
C8: New York, N.Y.10016
A10: PREMISES: | C10: Common Area
A13: KW: | C13: 536.29
A16: KWHR: | C16: 131282
A19: UTILITY RATE: | C19: Consolidated Edison SC-4 II Rate in effect November | H19: =+RatesFuelTax!D2 -> 2000
A22: ENERGY:
C23: On-Peak | D23: Kwhr: | E23: 90019 | F23: @ | G23: =+RatesFuelTax!B18 -> 9.3899999999999997E-2 | H23: =E23*G23 -> 8452.7840999999989
C24: Off-Peak | D24: Kwhr: | E24: 41263 | F24: @ | G24: =+RatesFuelTax!C18 -> 5.4100000000000002E-2 | H24: =E24*G24 -> 2232.3283000000001
A26: DEMAND:
C27: KW: | E27: 536.29 | F27: @ | G27: =+RatesFuelTax!D18 -> 20.91 | H27: =E27*G27 -> 11213.823899999999
A29: FUEL ADJUSTMENT: | D29: Kwhr: | E29: 131282 | F29: @ | G29: =+RatesFuelTax!E18 -> -2.5490000000000001E-3 | H29: =E29*G29 -> -334.63781799999998
D31: Sub-Total | H31: =SUM(H23:H30) -> 21564.298481999998
A33: GROSS RECEIPT TAX: | E33: =+RatesFuelTax!F18 -> 6.8462999999999996E-2 | H33: =H31*E33 -> 1476.3565669731659
D35: Sub-Total | H35: =SUM(H31:H34) -> 23040.655048973164
A37: SALES TAX: | E37: 8.2500000000000004E-2 | H37: =H35*E37 -> 1900.8540415402861
A39: CHARGE PER MONTH: | H39: =SUM(H34:H38) -> 24941.509090513449