A4: CLIENT: | C4: Mendik Realty Company
A7: ADDRESS: | C7: Two Park Avenue
C8: New York, N.Y.10016
A10: PREMISES: | C10: Common Area
A13: KW: | C13: 536.29
A16: KWHR: | C16: 131282
A19: UTILITY RATE: | C19: Consolidated Edison SC-4 II Rate in effect April | H19: =+RatesFuelTax!D2 -> 2000
A22: ENERGY:
C23: On-Peak | D23: Kwhr: | E23: 90019 | F23: @ | G23: =+RatesFuelTax!B11 -> 4.58E-2 | H23: =E23*G23 -> 4122.8702000000003
C24: Off-Peak | D24: Kwhr: | E24: 41263 | F24: @ | G24: =+RatesFuelTax!C11 -> 3.6299999999999999E-2 | H24: =E24*G24 -> 1497.8469
A26: DEMAND:
C27: KW: | E27: 536.29 | F27: @ | G27: =+RatesFuelTax!D11 -> 15.67 | H27: =E27*G27 -> 8403.6642999999985
A29: FUEL ADJUSTMENT: | D29: Kwhr: | E29: 131282 | F29: @ | G29: =+RatesFuelTax!E11 -> 1.7513000000000001E-2 | H29: =E29*G29 -> 2299.141666
D31: Sub-Total | H31: =SUM(H23:H30) -> 16323.523065999998
A33: GROSS RECEIPT TAX: | E33: =+RatesFuelTax!F11 -> 6.8462999999999996E-2 | H33: =H31*E33 -> 1117.5573596675579
D35: Sub-Total | H35: =SUM(H31:H34) -> 17441.080425667555
A37: SALES TAX: | E37: 8.2500000000000004E-2 | H37: =H35*E37 -> 1438.8891351175732
A39: CHARGE PER MONTH: | H39: =SUM(H34:H38) -> 18879.969560785128