A2: 1185 Avenue of the Americas
A4: Overtime HVAC
A6: Entire Building Cooling - Electric Supply Only
F8: Adj. | G8: Cooling | H8: Avg. Cost | I8: Cost
A9: Description | B9: Amps | C9: Volts | D9: Ph | E9: PF | F9: Factor | G9: Kwhr. | H9: Per Unit | I9: Total
A11: ROOF
A12: CoolingTower Fan #1 | B12: 71.50 | C12: 460.00 | D12: 3.00 | E12: 0.85 | F12: 0.85 | G12: =(B12*C12*1.732*E12*F12)/1000 -> 41.157559299999996
A13: CoolingTower Fan #2 | B13: 71.50 | C13: 460.00 | D13: 3.00 | E13: 0.85 | F13: 0.80 | G13: =(B13*C13*1.732*E13*F13)/1000 -> 38.736526399999995
A14: CoolingTower Fan #3 | B14: 71.50 | C14: 460.00 | D14: 3.00 | E14: 0.85 | F14: 0.75 | G14: =(B14*C14*1.732*E14*F14)/1000 -> 36.315493499999995
A15: CoolingTower Fan #4 | B15: 71.50 | C15: 460.00 | D15: 3.00 | E15: 0.85 | F15: 0.50 | G15: =(B15*C15*1.732*E15*F15)/1000 -> 24.210328999999998
A16: CoolingTower Fan #5 | B16: 71.50 | C16: 460.00 | D16: 3.00 | E16: 0.85 | F16: 0.00 | G16: =(B16*C16*1.732*E16*F16)/1000 -> 0.00
A18: Cooling Tower #3 MER
A19: Exhaust Fan #5 | B19: 4.10 | C19: 460.00 | D19: 3.00 | E19: 0.85 | F19: 0.85 | G19: =(B19*C19*1.732*E19*F19)/1000 -> 2.3600838199999994
A20: Exhaust Fan #6 | B20: 2.50 | C20: 460.00 | D20: 3.00 | E20: 0.85 | F20: 0.85 | G20: =(B20*C20*1.732*E20*F20)/1000 -> 1.4390755
A22: 28th Floor MER
A23: Cooling Tower M/U pump | B23: 4.20 | C23: 460.00 | D23: 3.00 | E23: 0.85 | F23: 0.10 | G23: =(B23*C23*1.732*E23*F23)/1000 -> 0.28442903999999997
A24: Exhaust Fan #1 | B24: 13.00 | C24: 460.00 | D24: 3.00 | E24: 0.85 | F24: 0.85 | G24: =(B24*C24*1.732*E24*F24)/1000 -> 7.4831925999999998
A25: Lower House Secondary Pump | B25: 119.00 | C25: 460.00 | D25: 3.00 | E25: 0.85 | F25: 0.85 | G25: =(B25*C25*1.732*E25*F25)/1000 -> 68.499993799999984
A26: Return Fan #1 | B26: 119.00 | C26: 460.00 | D26: 3.00 | E26: 0.85 | F26: 0.85 | G26: =(B26*C26*1.732*E26*F26)/1000 -> 68.499993799999984
A27: Return Fan #2 | B27: 119.00 | C27: 460.00 | D27: 3.00 | E27: 0.85 | F27: 0.85 | G27: =(B27*C27*1.732*E27*F27)/1000 -> 68.499993799999984
A28: Return Fan #3 | B28: 120.00 | C28: 460.00 | D28: 3.00 | E28: 0.85 | F28: 0.85 | G28: =(B28*C28*1.732*E28*F28)/1000 -> 69.075623999999976
A29: Supply Fan #1 | B29: 180.00 | C29: 460.00 | D29: 3.00 | E29: 0.85 | F29: 0.85 | G29: =(B29*C29*1.732*E29*F29)/1000 -> 103.61343600000001
A30: Supply Fan #2 | B30: 182.00 | C30: 460.00 | D30: 3.00 | E30: 0.85 | F30: 0.85 | G30: =(B30*C30*1.732*E30*F30)/1000 -> 104.76469640000001
A31: Supply Fan #3 | B31: 175.00 | C31: 460.00 | D31: 3.00 | E31: 0.85 | F31: 0.85 | G31: =(B31*C31*1.732*E31*F31)/1000 -> 100.73528499999999
A32: Supply Fan #4 | B32: 171.00 | C32: 460.00 | D32: 3.00 | E32: 0.85 | F32: 0.85 | G32: =(B32*C32*1.732*E32*F32)/1000 -> 98.432764199999994
A33: Supply Fan #5 | B33: 183.00 | C33: 460.00 | D33: 3.00 | E33: 0.85 | F33: 0.85 | G33: =(B33*C33*1.732*E33*F33)/1000 -> 105.3403266
A34: Supply Fan #6 | B34: 182.00 | C34: 460.00 | D34: 3.00 | E34: 0.85 | F34: 0.85 | G34: =(B34*C34*1.732*E34*F34)/1000 -> 104.76469640000001
A35: Upper House Secondary Pump | B35: 50.00 | C35: 460.00 | D35: 3.00 | E35: 0.85 | F35: 0.85 | G35: =(B35*C35*1.732*E35*F35)/1000 -> 28.781509999999997
A37: Sub Cellar Machine Room
A38: Air Compressor | B38: 17.50 | C38: 460.00 | D38: 3.00 | E38: 0.85 | F38: 0.50 | G38: =(B38*C38*1.732*E38*F38)/1000 -> 5.9256049999999991
A39: Air Dryer | B39: 5.30 | C39: 115.00 | D39: 1.00 | E39: 0.85 | F39: 0.65 | G39: =(B39*C39*E39*F39)/1000 -> 0.33674874999999999
A40: Chilled Water Pump | B40: 287.00 | C40: 460.00 | D40: 3.00 | E40: 0.85 | F40: 0.85 | G40: =(B40*C40*1.732*E40*F40)/1000 -> 165.20586739999999
A41: Cond Water Pump | B41: 354.00 | C41: 460.00 | D41: 3.00 | E41: 0.85 | F41: 0.85 | G41: =(B41*C41*1.732*E41*F41)/1000 -> 203.77309080000001
A42: Exhaust Fan #9 | B42: 3.40 | C42: 460.00 | D42: 3.00 | E42: 0.85 | F42: 0.85 | G42: =(B42*C42*1.732*E42*F42)/1000 -> 1.9571426799999998
A43: Return Fan #5 | B43: 20.00 | C43: 460.00 | D43: 3.00 | E43: 0.85 | F43: 0.85 | G43: =(B43*C43*1.732*E43*F43)/1000 -> 11.512604
A44: Return Fan #6 | B44: 18.70 | C44: 460.00 | D44: 3.00 | E44: 0.85 | F44: 0.85 | G44: =(B44*C44*1.732*E44*F44)/1000 -> 10.764284739999999
A45: Return Fan #7 | B45: 6.80 | C45: 460.00 | D45: 3.00 | E45: 0.85 | F45: 0.85 | G45: =(B45*C45*1.732*E45*F45)/1000 -> 3.9142853599999996
A46: Supply Fan #10 | B46: 13.00 | C46: 460.00 | D46: 3.00 | E46: 0.85 | F46: 0.85 | G46: =(B46*C46*1.732*E46*F46)/1000 -> 7.4831925999999998
A47: Supply Fan #7 | B47: 57.00 | C47: 460.00 | D47: 3.00 | E47: 0.85 | F47: 0.85 | G47: =(B47*C47*1.732*E47*F47)/1000 -> 32.810921399999998
A48: Supply Fan #8 | B48: 63.00 | C48: 460.00 | D48: 3.00 | E48: 0.85 | F48: 0.85 | G48: =(B48*C48*1.732*E48*F48)/1000 -> 36.2647026
A49: Supply Fan #9 | B49: 30.50 | C49: 460.00 | D49: 3.00 | E49: 0.85 | F49: 0.85 | G49: =(B49*C49*1.732*E49*F49)/1000 -> 17.556721099999997
A51: Electric Drive Chiller
A52: Electric Drive Chiller | B52: 882.00 | C52: 460.00 | D52: 3.00 | E52: 0.85 | F52: 0.85 | G52: =(B52*C52*1.732*E52*F52)/1000 -> 507.70583640000001
A53: Control Supply | B53: 20.00 | C53: 460.00 | D53: 3.00 | E53: 0.85 | F53: 0.85 | G53: =(B53*C53*1.732*E53*F53)/1000 -> 11.512604
A55: Total | G55: =SUM(G12:G54) -> 2089.7186159899998 | H55: 0.18 | I55: =G55*H55 -> 376.14935087819993
A57: Condenser Water
A58: Pump GPM | B58: Min | C58: Evap. % | D58: Gallons | E58: CCF
A59: 5700.00 | B59: 60.00 | C59: 0.02 | D59: =A59*B59*C59 -> 6840.00 | E59: =D59/748 -> 9.144385026737968 | H59: 5.23 | I59: =E59*H59 -> 47.825133689839575
A61: Repairs, Maintenance, Water Treatment, Labor
B62: Yearly Cost | C62: Hours/Yr.
B63: 108549 | C63: 3020.00 | I63: =B63/C63 -> 35.943377483443712
I67: =SUM(I55:I66) -> 459.91786205148321