A4: CLIENT: | C4: Demo Company
A7: ADDRESS: | C7: Demo Building
C8: New York, N.Y.10019
A10: PREMISES: | C10: Common Area
A13: KW: | C13: 3606.8
A16: KWHR: | C16: 896886
A19: UTILITY RATE: | C19: Consolidated Edison SC-4 II Rate in effect January | H19: =+RatesFuelTax!D2 -> 2001
A22: ENERGY:
C23: On-Peak | D23: Kwhr: | E23: 688448 | F23: @ | G23: =+RatesFuelTax!B8 -> 4.58E-2 | H23: =E23*G23 -> 31530.918399999999
C24: Off-Peak | D24: Kwhr: | E24: 208438 | F24: @ | G24: =+RatesFuelTax!C8 -> 3.6299999999999999E-2 | H24: =E24*G24 -> 7566.2993999999999
A26: DEMAND:
C27: KW: | E27: 3606.8 | F27: @ | G27: =+RatesFuelTax!D8 -> 15.67 | H27: =E27*G27 -> 56518.556000000004
A29: FUEL ADJUSTMENT: | D29: Kwhr: | E29: 896886 | F29: @ | G29: =+RatesFuelTax!E8 -> 1.3443999999999999E-2 | H29: =E29*G29 -> 12057.735384
D31: Sub-Total | H31: =SUM(H23:H30) -> 107673.509184
A33: GROSS RECEIPT TAX: | E33: =+RatesFuelTax!F8 -> 6.8686999999999998E-2 | H33: =H31*E33 -> 7395.7703253214077
D35: Sub-Total | H35: =SUM(H31:H34) -> 115069.27950932141
A37: SALES TAX: | E37: 8.2500000000000004E-2 | H37: =H35*E37 -> 9493.2155595190161
D38: TOTAL COST FOR
A39: CHARGE PER MONTH: | H39: =SUM(H34:H38) -> 124562.49506884042