A4: CLIENT: | C4: Mendik Realty Company
A7: ADDRESS: | C7: 40 Fulton Street
C8: New York, N.Y.10036
A10: PREMISES: | C10: Common Area
A13: KW: | C13: 151.28
A16: KWHR: | C16: 43790
A19: UTILITY RATE: | C19: Consolidated Edison SC-9 Rate in effect November | G19: =+RatesFuelTax!D2 -> 2000
A22: ENERGY:
C23: Kwhrs: 1st | D23: 15000 | E23: @ | F23: =+RatesFuelTax!B18 -> 8.5999999999999993E-2 | H23: =D23*F23 -> 1290
D24: 28790 | E24: @ | F24: =+RatesFuelTax!C18 -> 8.5999999999999993E-2 | H24: =D24*F24 -> 2475.94
A26: DEMAND: | C26: KW:
D27: 151.28 | E27: @ | F27: =+RatesFuelTax!D18 -> 19.99 | H27: =D27*F27 -> 3024.0871999999999
A29: FUEL ADJUSTMENT
C30: Kwhr: | D30: 43790 | E30: @ | F30: =+RatesFuelTax!E18 -> -2.5490000000000001E-3 | H30: =D30*F30 -> -111.62071
D31: Sub-Total | H31: =SUM(H23:H30) -> 6678.4064899999994
A33: GROSS RECEIPT TAX: | E33: =+RatesFuelTax!F18 -> 6.8462999999999996E-2 | H33: =H31*E33 -> 457.22374352486992
D35: Sub-Total | H35: =SUM(H31:H34) -> 7135.6302335248693
A37: SALES TAX: | E37: 8.2500000000000004E-2 | H37: =H35*E37 -> 588.68949426580173
A39: CHARGE PER MONTH: | H39: =SUM(H35:H38) -> 7724.3197277906711