A4: CLIENT: | C4: Mendik Realty Company
A7: ADDRESS: | C7: 40 Fulton Street
C8: New York, N.Y.10036
A10: PREMISES: | C10: Common Area
A13: KW: | C13: 221
A16: KWHR: | C16: 80780
A19: UTILITY RATE: | C19: Consolidated Edison SC-9 Rate in effect January | G19: =+RatesFuelTax!D2 -> 2000
A22: ENERGY:
C23: Kwhrs: 1st | D23: 15000 | E23: @ | F23: =+RatesFuelTax!B8 -> 5.8099999999999999E-2 | H23: =D23*F23 -> 871.5
D24: 65780 | E24: @ | F24: =+RatesFuelTax!C8 -> 5.4199999999999998E-2 | H24: =D24*F24 -> 3565.2759999999998
A26: DEMAND: | C26: KW:
D27: 221 | E27: @ | F27: =+RatesFuelTax!D8 -> 18.65 | H27: =D27*F27 -> 4121.65
A29: FUEL ADJUSTMENT
C30: Kwhr: | D30: 80780 | E30: @ | F30: =+RatesFuelTax!E8 -> 1.3443999999999999E-2 | H30: =D30*F30 -> 1086.00632
D31: Sub-Total | H31: =SUM(H23:H30) -> 9644.4323199999999
A33: GROSS RECEIPT TAX: | E33: =+RatesFuelTax!F8 -> 6.8686999999999998E-2 | H33: =H31*E33 -> 662.44712276383996
D35: Sub-Total | H35: =SUM(H31:H34) -> 10306.87944276384
A37: SALES TAX: | E37: 8.2500000000000004E-2 | H37: =H35*E37 -> 850.31755402801684
A39: CHARGE PER MONTH: | H39: =SUM(H35:H38) -> 11157.196996791858