A4: CLIENT: | C4: Mendik Realty Company
A7: ADDRESS: | C7: 40 Fulton Street
C8: New York, N.Y.10036
A10: PREMISES: | C10: Common Area
A13: KW: | C13: 151.28
A16: KWHR: | C16: 43790
A19: UTILITY RATE: | C19: Consolidated Edison SC-9 Rate in effect March | G19: =+RatesFuelTax!D2 -> 2000
A22: ENERGY:
C23: Kwhrs: 1st | D23: 15000 | E23: @ | F23: =+RatesFuelTax!B10 -> 5.8099999999999999E-2 | H23: =D23*F23 -> 871.5
D24: 28790 | E24: @ | F24: =+RatesFuelTax!C10 -> 5.4199999999999998E-2 | H24: =D24*F24 -> 1560.4179999999999
A26: DEMAND: | C26: KW:
D27: 151.28 | E27: @ | F27: =+RatesFuelTax!D10 -> 18.65 | H27: =D27*F27 -> 2821.3719999999998
A29: FUEL ADJUSTMENT
C30: Kwhr: | D30: 43790 | E30: @ | F30: =+RatesFuelTax!E10 -> 2.0899999999999998E-2 | H30: =D30*F30 -> 915.2109999999999
D31: Sub-Total | H31: =SUM(H23:H30) -> 6168.5009999999993
A33: GROSS RECEIPT TAX: | E33: =+RatesFuelTax!F10 -> 6.8686999999999998E-2 | H33: =H31*E33 -> 423.69582818699996
D35: Sub-Total | H35: =SUM(H31:H34) -> 6592.1968281869995
A37: SALES TAX: | E37: 8.2500000000000004E-2 | H37: =H35*E37 -> 543.85623832542751
A39: CHARGE PER MONTH: | H39: =SUM(H35:H38) -> 7136.053066512427