A4: CLIENT: | C4: Mendik Realty Company
A7: ADDRESS: | C7: 40 Fulton Street
C8: New York, N.Y.10036
A10: PREMISES: | C10: Common Area
A13: KW: | C13: 294.41
A16: KWHR: | C16: 93928
A19: UTILITY RATE: | C19: Consolidated Edison SC-9 Rate in effect September | G19: =+RatesFuelTax!D2 -> 2000
A22: ENERGY:
C23: Kwhrs: 1st | D23: 15000 | E23: @ | F23: 9.4700000000000006E-2 | H23: =D23*F23 -> 1420.5
D24: 78928 | E24: @ | F24: 9.4700000000000006E-2 | H24: =D24*F24 -> 7474.4816000000001
A26: DEMAND: | C26: KW:
D27: 294.41 | E27: @ | F27: 19.09 | H27: =D27*F27 -> 5620.2869000000001
A29: FUEL ADJUSTMENT
C30: Kwhr: | D30: 93928 | E30: @ | F30: =+RatesFuelTax!E16 -> 1.0182E-2 | H30: =D30*F30 -> 956.37489600000004
D31: Sub-Total | H31: =SUM(H23:H30) -> 15471.643395999998
A33: GROSS RECEIPT TAX: | E33: =+RatesFuelTax!F16 -> 6.8462999999999996E-2 | H33: =H31*E33 -> 1059.2351218203478
D35: Sub-Total | H35: =SUM(H31:H34) -> 16530.878517820347
A37: SALES TAX: | E37: 8.2500000000000004E-2 | H37: =H35*E37 -> 1363.7974777201787
A39: CHARGE PER MONTH: | H39: =SUM(H35:H38) -> 17894.675995540525