B7: CLIENT: | D7: Mendik Realty Company
B9: ADDRESS: | D9: 40 Fulton Street
D10: New York,N.Y.10036
B12: PREMISES: | D12: =+RatesFuelTax!D2 -> 2000 | E12: Monthly Summary of Common Area Cost
B14: JANUARY | H14: =+JAN!H39 -> 11157.196996791858
B16: FEBRUARY | H16: =+FEB!H39 -> 7422.7302114534123
B18: MARCH | H18: =+MAR!H39 -> 7136.053066512427
B20: APRIL | H20: =+APR!H39 -> 6963.012537695362
B22: MAY | H22: =+MAY!H39 -> 6591.1250608391292
B24: JUNE | H24: =+JUN!H39 -> 16193.836703336265
B26: JULY | H26: =+JUL!H39 -> 17448.93355711985
B28: AUGUST | H28: =+AUG!H39 -> 19107.078045936512
B30: SEPTEMBER | H30: =+SEP!H39 -> 17894.675995540525
B32: OCTOBER | H32: =+OCT!H39 -> 7148.4050525759203
B34: NOVEMBER | H34: =+NOV!H39 -> 7724.3197277906711
B36: DECEMBER | H36: =+DEC!H39 -> 7891.8126781381734
D38: TOTAL COST FOR | G38: =+RatesFuelTax!D2 -> 2000 | H38: =SUM(H14:H37) -> 132679.17963373012