A4: CLIENT: | C4: Mendik Realty Company
A7: ADDRESS: | C7: 40 Fulton Street
C8: New York, N.Y.10036
A10: PREMISES: | C10: Common Area
A13: KW: | C13: 151.28
A16: KWHR: | C16: 43790
A19: UTILITY RATE: | C19: Consolidated Edison SC-9 Rate in effect May | G19: =+RatesFuelTax!D2 -> 2000
A22: ENERGY:
C23: Kwhrs: 1st | D23: 15000 | E23: @ | F23: 6.6000000000000003E-2 | H23: =D23*F23 -> 990
D24: 28790 | E24: @ | F24: 6.6000000000000003E-2 | H24: =D24*F24 -> 1900.14
A26: DEMAND: | C26: KW:
D27: 151.28 | E27: @ | F27: 18.4 | H27: =D27*F27 -> 2783.5519999999997
A29: FUEL ADJUSTMENT
C30: Kwhr: | D30: 43790 | E30: @ | F30: =+RatesFuelTax!E12 -> 5.6999999999999998E-4 | H30: =D30*F30 -> 24.9603
D31: Sub-Total | H31: =SUM(H23:H30) -> 5698.6522999999997
A33: GROSS RECEIPT TAX: | E33: =+RatesFuelTax!F12 -> 6.8462999999999996E-2 | H33: =H31*E33 -> 390.14683241489996
D35: Sub-Total | H35: =SUM(H31:H34) -> 6088.7991324148998
A37: SALES TAX: | E37: 8.2500000000000004E-2 | H37: =H35*E37 -> 502.32592842422923
A39: CHARGE PER MONTH: | H39: =SUM(H35:H38) -> 6591.1250608391292