B6: CLIENT: | D6: Americacn Airlines T9
B8: ADDRESS: | D8: TERMINAL 9 JFK INTL AIRPORT ATTN: SHAWN SAGIVJAMAICA, NY 11430
D9: New York,N.Y.10019
B11: PREMISES: | D11: =+RatesFuelTax!D2 -> 2001 | E11: Monthly Summary of Common Area Cost
B14: JANUARY | H14: =+JAN!H39 -> 124562.49506884042
B16: FEBRUARY | H16: =+FEB!H39 -> 138170.17141976865
B18: MARCH | H18: =+MAR!H39 -> 132298.58617616189
B20: APRIL | H20: =+APR!H39 -> 128759.47590891444
B22: MAY | H22: =+MAY!H39 -> 138207.58816033686
B24: JUNE | H24: =+JUN!H39 -> 269066.29160909849
B26: JULY | H26: =+JUL!H39 -> 284126.84548163816
B28: AUGUST | H28: =+AUG!H39 -> 304015.18776166963
B30: SEPTEMBER | H30: =+SEP!H39 -> 289473.23009639076
B32: OCTOBER | H32: =+OCT!H39 -> 149621.53250079916
B34: NOVEMBER | H34: =+NOV!H39 -> 172401.6251400231
B36: DECEMBER | H36: =+DEC!H39 -> 175832.13626734371
D38: TOTAL COST FOR | G38: =+RatesFuelTax!D2 -> 2001 | H38: =SUM(H14:H37) -> 2306535.1655909847